,review_text
0,"If you're here with family, friends, with two, solo, just buy the whole dang pizza because you'll regret not having the chance to scarf it down. Sure, you might have leftovers- take it home and freeze if it makes it until the next day. Or you can stand in line again for another half; the line is terribly long down the street, but the place is so efficient it will only take minutes. This pizza is good because of the dough. The dough is good because it is, in essence, bread. Good bread. Bread that can be eaten without the fripperies of tomato sauce, cheese, and whatever one topping they decide to do for the day. But they add this stuff to the good bread and it becomes a lovely pizza."
1,"When I told my LA friends I was heading up to Berkeley, two said this was the ""best"" place and that I ""must go."" They raved about the eggplant topping. Wait time & seating: Came around 2pm on a Saturday and the line took us about 20-30minutes. There is an incredibly limited amount of seating for the amount of people who come by, so get to praying before you arrive. We lucked out with seats by the live band, which was neat but made it difficult to talk without yelling. Pizza comes out incredibly fast, because they only serve one type per day. Food: I'm personally a fan of thicker, chewier crusts, so this was disappointing and didn't amount to the hype it received. It was average pizza with average, unmemorable toppings (the day I went). It's probably better other days, but not a fan of the ""take your chance"" game if I'm craving pizza one day. Price: For $24 (after tax), the pizza certainly wasn't worth it. More of a hype place, based on that day's pizza."
2,"I've heard about the Cheese Board from multiple friends for a long time but have not tried it until last week. We arrived around 11am and there were already a lot of people there because the bakery/cheese side is open by 8am. Even though the pizza side doesn't open until 11:30, there were already a lot of people waiting around for it. I recommend getting there early if you want to avoid a wait. People start to form an official line as soon as they open at 11:30.I didn't try and of the cheese but the bakery side had lots of good bread and baked goods options. We ended up buying the Sunday Bread, scone, chocolate things, and the Ginger Molasses cookie. All of them were really good! The Sunday bread and chocolate things can be a bit dense and dry if you eat it the next day but I found microwaving them to be a good way to enjoy them :) I found out that the Cheese Board only makes one flavor a day. The pizza of the day was with roasted potatoes (carbs on carbs), caramelized onions, mozzarella, and cave aged gruyere, cheese, garlic olive oil, parsley, and oregano. Even though they only make one flavor a day they do have vegan options. The pizzas were very reasonably priced, at $3 slice. When I got the pizza it was  burning hot, which is not necessarily a bad thing but I found it hard to even leave it on my lap when I was trying to eat it in their outdoor seating area. Even though I'm not usually a pizza fan, I enjoyed the pizza here and would consider coming back if I'm ever in the area again.Pros:- Bakery and Cheese shop open early, can shop there while waiting for the pizza- Half baked pizza available at the bakery- Fresh pizza - Vegetarian and Vegan optionsCons:- Only one flavor so if you don't like it then there's not much of an alternative- Long lines and really crowded - Staffs are not the friendliest people, don't really bother to greet you or even smile- Pizza on the oily size so make sure to grab napkins!"
3,"If you a cheese lover, you have to come here. They have so many cheeses I didn't even know existed.They also have a large variety of breads, though not as extravagant as their cheese selection. I got 6 English muffins for $5.50. I'm not a big fan of English muffins, but they were the best English muffins I've ever had. I ate one right when I got them, and put the rest in the fridge hoping they would still be fluffy. When I took them out of the fridge, they were rock hard, but I popped them in the fridge. Like magic, they were back to the soft soft fluffy English muffins they were the day before. So far, I haven't tried anything else, but am definitely going to go back and try their other breads and cheeses.**note: If you are looking for pizza, it's next door. I accidentally came in here because I was in a hurry and saw the word cheese and thought this was Cheese Board Pizza. (silly me)TL;DR Cheese heaven"
4,"Good selection of cheese, bread and other sweet and savory snacks.  Coffee is decent. The sweet goodies aren't that sugary, which is a good thing for me. Store hours are short. Staff is polite but don't not friendly enough to spend much time with you explaining about the products."
5,"Wow, an array of cheeses and it was packed on a Saturday afternoon! I snuck into the bread line and got two cheese breads, a wolverine, and an olive focaccia bread. Only had the cheese breads, and my friend loved the burnt cheese all over it. It was a little too burnt and crunch for me, but it was really delicious! Fresh and warm out of the oven! Prices are really fair as well."
6,"Before there was Cheese Board Pizza there was the Cheese Board Collective.  They've been in Berkeley since 1967 and were, along w/ Peet's, the beginnings of the Gourmet Ghetto.  They became a worker owned co-op in 1971.  They were one of the first cheese shops I encountered as a young woman and they were probably the first bakery in Berkeley to make a proper baguette w/ the authentic texture.  In the beginning they were a cool little shop and over the decades they have grown into a powerhouse.  They still sell a wide variety of cheeses, but they also sell a rotating range of baked goods, most savory and some sweet and their iconic pizza.  The pizza is sold half baked to take home or ready to eat slices to eat there, or on the median strip, despite the signs.  We check their pizza offerings, which change daily, online and buy half a pizza to bake for dinner when it sounds good.  I have a separate review for Cheese Board Pizza, which has become our preferred pizza source because of their imaginative combinations.  The Cheese Board also has live music, one group at lunch, another at dinner, which is very cool"
7,"Even with the storm, this doesn't seem to deter the huge crowds on a Saturday morning wanting their gluten fix. Came here with the intent of buying some cheese, but ended up with a bag of baked goods, pizza, and their green sauce.  I'm obsessed with their green sauce, and will slather it on everything possible! So excited that the cheese shop carries them here for $4/container. They have tons of local and international cheeses, with samples available. They also carry Cowgirl Creamery! My favs: cheese rolls, provolone olive roll, and all their Cowgirl Creamery cheeses PRO TIP: They sell their half baked pizzas at the bakery as well, if you want to avoid the lines at their restaurant next door. However, there's lines here too, but they move quick!"
8,"It was my very first time here yesterday and I was shocked at how many people were waiting in line for this pizza. I thought to myself, wow is it really that good? Lol well it definitely was tasty! I've never had a pizza like this! The flavor was so tangy and delicious definitely worth the 25 min wait!"
9,"- Had a special ""Pride Celebration"" pizza... Heirloom tomato, red onion, mozzarella and aged Asiago cheese, garlic olive oil, parsley, oregano. Highly recommend it.- A little on the cheesy side for my own liking...but thats to be expected given the name, and the cheese was amazing. - Very reasonably priced...2/3 people can split a large pizza and it comes to $22 total. - Also has exclusively vegetarian options...which is a win in my book :) - Overall one of the best pizzas I've had in the Bay."
10,"Been around for years so they don't need validation from me - but the place is clean,consistent and the food is amazing! The food, specifically, being that daily chef chosen pizza!"
11,"My cousin brought me a tub of ricotta last night.It's now 8:44am the following day..and it's almost gone.Ricotta, bread, breakfast.This is the ricotta in the metal tin that they put in a plastic tub for you. Not too sure of the producer.But, I'm in cheese heaven."
12,This place is a national treasure as I have not been there for a while and only downside is closed Sunday. It only gets better with age  and the brioche is better than ever and the cheese bread is cheesier. Best of its type in USA.
13,"People say it's much better than Sliver but I can't really say. The pizza is great, and I think the cilantro sauce is less salty. I love how thin the crust is. Good for vegetarians.The band performing was absolutely beautiful."
14,"This place is amazing. Great variety of cheeses and all sorts of delights to pair them with from fresh baked breads to delicious jams and whole honeycombs. Parking is a bit of a free for all and you'll likely have to pay to park in a lot unless you can find street parking off to the side somewhere.At the cheese counter, pick up a playing card and when your card is called you get one on one treatment from a cheese expert. They have you try each cheese before buying as the taste can vary from batch to batch and even among wheels. I'm a big cheese fan so it was hard not to love everything I tried but I particularly enjoyed both the Swiss and French raclette and a very creamy brie that I can't recall the name of but Vicky can tell you as it is one of her favorites which she suggested to me.Aside from the cheese, we always pick up a whole honeycomb and a seeded baguette. Also popular are their cheese rolls which are a tasty sourdough with delicious cheese globs baked into it. I do prefer the cheese rolls at Acme though, where the cheese is blended in the dough and every bite is elasticy cheesy bready goodness."
15,"Excellent pastries and cheeses. Can recommend the cheese bread, carrot muffin and the cornbread sconces. Delicious!"
16,"Like I said in my last review, I did come back to try more muffins and a few ""chocolate things""! It was around 7:30 AM on a Friday and the place was already busy, but not enough to have a line :)**After the success of the apple apricot muffin last time, I picked a carrot spice muffin which was full of raisins, golden raisins, nuts, and of course carrots. Would recommend! **The chocolate things were also amazing, they're full of huge chocolate chunks rather than maybe a swirl, and the bread itself is soft and chewy. Make sure to eat the chocolate things while they're warm (i.e. Heat them up the next day) because otherwise they get kind of hard. **Also picked up a few scones -- 1 berry/lemon and 1 berry/corn (yum!! Texture is a mix between cornbread and scone) --  which were good but TL;DR if you can only pick a few things I'd definitely go for a muffin or chocolate thing."
17,Tasty healthy vegan pizza! It's harf to believe it isnt real cheese! Definetly stop by for fresh and hot pizza if youre In the area =) they also serve organic soft serve. yummm!
18,Can't go wrong with a pizza from here and their green sauce. Line can seem intimidating but it moves fast! The pro of serving only one flavor a day. Seating can be a game of chance but I haven't had any issues the times I've been.
19,Have only been here once and never knew about this amazing place. I love simple concepts like this. One flavor of pizza each day. Stand in line. Get your slice. And eat. My boyfriend and I tried this place out because he loves pizza. I cannot recall what the pizza flavor was for the day but it was simple and didn't have any fancy cheeses or veggies on there. We grabbed about four slices and two glasses of wine. Sat at a table near the open windows. Listened the a live band play during dinner. And ended up sharing our table with a few strangers during the night.It was very casual. And comfortable. The food was great and the ambiance was chill. And it was cheap overall. They have a website if you don't want to be spontaneous. It displays their pizza flavor for the day. So if you want to know before you make the drive out there. It's convenient. Good luck! And don't forget to purchase the baked garlic. Yum!
20,"If you're here with family, friends, with two, solo, just buy the whole dang pizza because you'll regret not having the chance to scarf it down. Sure, you might have leftovers- take it home and freeze if it makes it until the next day. Or you can stand in line again for another half; the line is terribly long down the street, but the place is so efficient it will only take minutes. This pizza is good because of the dough. The dough is good because it is, in essence, bread. Good bread. Bread that can be eaten without the fripperies of tomato sauce, cheese, and whatever one topping they decide to do for the day. But they add this stuff to the good bread and it becomes a lovely pizza."
21,"When I told my LA friends I was heading up to Berkeley, two said this was the ""best"" place and that I ""must go."" They raved about the eggplant topping. Wait time & seating: Came around 2pm on a Saturday and the line took us about 20-30minutes. There is an incredibly limited amount of seating for the amount of people who come by, so get to praying before you arrive. We lucked out with seats by the live band, which was neat but made it difficult to talk without yelling. Pizza comes out incredibly fast, because they only serve one type per day. Food: I'm personally a fan of thicker, chewier crusts, so this was disappointing and didn't amount to the hype it received. It was average pizza with average, unmemorable toppings (the day I went). It's probably better other days, but not a fan of the ""take your chance"" game if I'm craving pizza one day. Price: For $24 (after tax), the pizza certainly wasn't worth it. More of a hype place, based on that day's pizza."
22,"I've heard about the Cheese Board from multiple friends for a long time but have not tried it until last week. We arrived around 11am and there were already a lot of people there because the bakery/cheese side is open by 8am. Even though the pizza side doesn't open until 11:30, there were already a lot of people waiting around for it. I recommend getting there early if you want to avoid a wait. People start to form an official line as soon as they open at 11:30.I didn't try and of the cheese but the bakery side had lots of good bread and baked goods options. We ended up buying the Sunday Bread, scone, chocolate things, and the Ginger Molasses cookie. All of them were really good! The Sunday bread and chocolate things can be a bit dense and dry if you eat it the next day but I found microwaving them to be a good way to enjoy them :) I found out that the Cheese Board only makes one flavor a day. The pizza of the day was with roasted potatoes (carbs on carbs), caramelized onions, mozzarella, and cave aged gruyere, cheese, garlic olive oil, parsley, and oregano. Even though they only make one flavor a day they do have vegan options. The pizzas were very reasonably priced, at $3 slice. When I got the pizza it was  burning hot, which is not necessarily a bad thing but I found it hard to even leave it on my lap when I was trying to eat it in their outdoor seating area. Even though I'm not usually a pizza fan, I enjoyed the pizza here and would consider coming back if I'm ever in the area again.Pros:- Bakery and Cheese shop open early, can shop there while waiting for the pizza- Half baked pizza available at the bakery- Fresh pizza - Vegetarian and Vegan optionsCons:- Only one flavor so if you don't like it then there's not much of an alternative- Long lines and really crowded - Staffs are not the friendliest people, don't really bother to greet you or even smile- Pizza on the oily size so make sure to grab napkins!"
23,"If you a cheese lover, you have to come here. They have so many cheeses I didn't even know existed.They also have a large variety of breads, though not as extravagant as their cheese selection. I got 6 English muffins for $5.50. I'm not a big fan of English muffins, but they were the best English muffins I've ever had. I ate one right when I got them, and put the rest in the fridge hoping they would still be fluffy. When I took them out of the fridge, they were rock hard, but I popped them in the fridge. Like magic, they were back to the soft soft fluffy English muffins they were the day before. So far, I haven't tried anything else, but am definitely going to go back and try their other breads and cheeses.**note: If you are looking for pizza, it's next door. I accidentally came in here because I was in a hurry and saw the word cheese and thought this was Cheese Board Pizza. (silly me)TL;DR Cheese heaven"
24,"Good selection of cheese, bread and other sweet and savory snacks.  Coffee is decent. The sweet goodies aren't that sugary, which is a good thing for me. Store hours are short. Staff is polite but don't not friendly enough to spend much time with you explaining about the products."
25,"Wow, an array of cheeses and it was packed on a Saturday afternoon! I snuck into the bread line and got two cheese breads, a wolverine, and an olive focaccia bread. Only had the cheese breads, and my friend loved the burnt cheese all over it. It was a little too burnt and crunch for me, but it was really delicious! Fresh and warm out of the oven! Prices are really fair as well."
26,"Before there was Cheese Board Pizza there was the Cheese Board Collective.  They've been in Berkeley since 1967 and were, along w/ Peet's, the beginnings of the Gourmet Ghetto.  They became a worker owned co-op in 1971.  They were one of the first cheese shops I encountered as a young woman and they were probably the first bakery in Berkeley to make a proper baguette w/ the authentic texture.  In the beginning they were a cool little shop and over the decades they have grown into a powerhouse.  They still sell a wide variety of cheeses, but they also sell a rotating range of baked goods, most savory and some sweet and their iconic pizza.  The pizza is sold half baked to take home or ready to eat slices to eat there, or on the median strip, despite the signs.  We check their pizza offerings, which change daily, online and buy half a pizza to bake for dinner when it sounds good.  I have a separate review for Cheese Board Pizza, which has become our preferred pizza source because of their imaginative combinations.  The Cheese Board also has live music, one group at lunch, another at dinner, which is very cool"
27,"Even with the storm, this doesn't seem to deter the huge crowds on a Saturday morning wanting their gluten fix. Came here with the intent of buying some cheese, but ended up with a bag of baked goods, pizza, and their green sauce.  I'm obsessed with their green sauce, and will slather it on everything possible! So excited that the cheese shop carries them here for $4/container. They have tons of local and international cheeses, with samples available. They also carry Cowgirl Creamery! My favs: cheese rolls, provolone olive roll, and all their Cowgirl Creamery cheeses PRO TIP: They sell their half baked pizzas at the bakery as well, if you want to avoid the lines at their restaurant next door. However, there's lines here too, but they move quick!"
28,"It was my very first time here yesterday and I was shocked at how many people were waiting in line for this pizza. I thought to myself, wow is it really that good? Lol well it definitely was tasty! I've never had a pizza like this! The flavor was so tangy and delicious definitely worth the 25 min wait!"
29,"- Had a special ""Pride Celebration"" pizza... Heirloom tomato, red onion, mozzarella and aged Asiago cheese, garlic olive oil, parsley, oregano. Highly recommend it.- A little on the cheesy side for my own liking...but thats to be expected given the name, and the cheese was amazing. - Very reasonably priced...2/3 people can split a large pizza and it comes to $22 total. - Also has exclusively vegetarian options...which is a win in my book :) - Overall one of the best pizzas I've had in the Bay."
30,"Been around for years so they don't need validation from me - but the place is clean,consistent and the food is amazing! The food, specifically, being that daily chef chosen pizza!"
31,"My cousin brought me a tub of ricotta last night.It's now 8:44am the following day..and it's almost gone.Ricotta, bread, breakfast.This is the ricotta in the metal tin that they put in a plastic tub for you. Not too sure of the producer.But, I'm in cheese heaven."
32,This place is a national treasure as I have not been there for a while and only downside is closed Sunday. It only gets better with age  and the brioche is better than ever and the cheese bread is cheesier. Best of its type in USA.
33,"People say it's much better than Sliver but I can't really say. The pizza is great, and I think the cilantro sauce is less salty. I love how thin the crust is. Good for vegetarians.The band performing was absolutely beautiful."
34,"This place is amazing. Great variety of cheeses and all sorts of delights to pair them with from fresh baked breads to delicious jams and whole honeycombs. Parking is a bit of a free for all and you'll likely have to pay to park in a lot unless you can find street parking off to the side somewhere.At the cheese counter, pick up a playing card and when your card is called you get one on one treatment from a cheese expert. They have you try each cheese before buying as the taste can vary from batch to batch and even among wheels. I'm a big cheese fan so it was hard not to love everything I tried but I particularly enjoyed both the Swiss and French raclette and a very creamy brie that I can't recall the name of but Vicky can tell you as it is one of her favorites which she suggested to me.Aside from the cheese, we always pick up a whole honeycomb and a seeded baguette. Also popular are their cheese rolls which are a tasty sourdough with delicious cheese globs baked into it. I do prefer the cheese rolls at Acme though, where the cheese is blended in the dough and every bite is elasticy cheesy bready goodness."
35,"Excellent pastries and cheeses. Can recommend the cheese bread, carrot muffin and the cornbread sconces. Delicious!"
36,"Like I said in my last review, I did come back to try more muffins and a few ""chocolate things""! It was around 7:30 AM on a Friday and the place was already busy, but not enough to have a line :)**After the success of the apple apricot muffin last time, I picked a carrot spice muffin which was full of raisins, golden raisins, nuts, and of course carrots. Would recommend! **The chocolate things were also amazing, they're full of huge chocolate chunks rather than maybe a swirl, and the bread itself is soft and chewy. Make sure to eat the chocolate things while they're warm (i.e. Heat them up the next day) because otherwise they get kind of hard. **Also picked up a few scones -- 1 berry/lemon and 1 berry/corn (yum!! Texture is a mix between cornbread and scone) --  which were good but TL;DR if you can only pick a few things I'd definitely go for a muffin or chocolate thing."
37,Tasty healthy vegan pizza! It's harf to believe it isnt real cheese! Definetly stop by for fresh and hot pizza if youre In the area =) they also serve organic soft serve. yummm!
38,Can't go wrong with a pizza from here and their green sauce. Line can seem intimidating but it moves fast! The pro of serving only one flavor a day. Seating can be a game of chance but I haven't had any issues the times I've been.
39,Have only been here once and never knew about this amazing place. I love simple concepts like this. One flavor of pizza each day. Stand in line. Get your slice. And eat. My boyfriend and I tried this place out because he loves pizza. I cannot recall what the pizza flavor was for the day but it was simple and didn't have any fancy cheeses or veggies on there. We grabbed about four slices and two glasses of wine. Sat at a table near the open windows. Listened the a live band play during dinner. And ended up sharing our table with a few strangers during the night.It was very casual. And comfortable. The food was great and the ambiance was chill. And it was cheap overall. They have a website if you don't want to be spontaneous. It displays their pizza flavor for the day. So if you want to know before you make the drive out there. It's convenient. Good luck! And don't forget to purchase the baked garlic. Yum!
40,"If you're here with family, friends, with two, solo, just buy the whole dang pizza because you'll regret not having the chance to scarf it down. Sure, you might have leftovers- take it home and freeze if it makes it until the next day. Or you can stand in line again for another half; the line is terribly long down the street, but the place is so efficient it will only take minutes. This pizza is good because of the dough. The dough is good because it is, in essence, bread. Good bread. Bread that can be eaten without the fripperies of tomato sauce, cheese, and whatever one topping they decide to do for the day. But they add this stuff to the good bread and it becomes a lovely pizza."
