,review_text
52,I like the relaxed atmosphere and live music was great. They have only one type of pizza per day but boy was is greasy when I was there. I ended up not eating most of it as it was dripping with oil and I felt not great for the rest of the day.
53,"Food is worth the wait but the experience and staff is not.After following the lemmings to this pizza joint I waited a good 20 minutes in line to order my food. New to The Cheese Board I found their one type of pizza menu intriguing, ordered two slices and a beer and made my way to a table with a vacant seat. I set my food down and start to sit when a girl comes over and points to a bag sitting across the table from my food. Doesn't speak just points awkwardly as if I should know that's her seat. Her's, who is still in line. Waiting to order. While I paid my money and have my food.I look at her, pick up my food and walk away shaking my head. Outside I find another squatter sitting at a table holding it for her party while they wait to order food. I ask if I can eat there, she says yes. But it's sans chair so I ask the neighboring table if I can use one of their empty chairs. The girl says ""No, we have friends coming"". ""Can I use sit until they arrive?"" ""No, they're almost here"".I stand dumbfounded, shake my head and start to eat. Standing up. Feeling like Forest Gump but older and with more confidence I go to a guy working behind the counter and ask if they have a sitting policy because I've ordered my food but can't find a seat while other customers who have yet to pay are saving seats.He brushes me off with a self righteous grunt and I return to eating like a giraffe seriously questioning the Berkley I'm in right now. Maybe I should talk to people in terms they understand ""Hey Berkley, I feel displaced like a Syrian refugee and just want to eat my food sitting down. Can you help a brother out?""I see a lone chair in in the corner and no one puts baby in the corner...and yet Cheese Board Pizza did. Where is Patrick Swayze (...to soon?)Listen up Cheese Board Pizza, your food is good so why not create some policies that make your patron's feel welcomed and wanted. Take a page from Maple & Motor in Dallas. They too are very popular and posts signs instructing their patron's that seats and tables are for patron's who have ordered their food, and not people waiting to order."
54,"I had been reading about their soft serve ice cream for weeks, and was looking forward to trying it. So, today I had one of their half chocolate / half vanilla swirl cones. It reminded me of the old joke ""the food was terrible, and the portions were so small""! Actually, the soft serve was not exactly terrible, but it was too sweet, had no discernible vanilla or chocolate flavor whatsoever, and lacked the lightness and freshness of the best soft serve. The ""richness"" that other reviewers have described felt to me more like goopiness. To add insult to injury, the soft serve barely extended an inch above the rim of the tiny cone. Maybe making soft serve from buffalo milk is not such a good idea after all."
55,"It was a real mixed bag,  mostly positive so I should get down to the reason for two stars. I went to the counter for a second glass of wine, tendered $10 for  a  $5 glass of wine and was given $4 in change. I questioned that and was told it was $5 plus tax. The last I knew, the  tax in CA is not 20%. With very ill grace I was given my proper change. Now, 50 some cents is not a big deal but gosh  darned it, you tender the right change. I have no idea if it was just this cashier or if it is a policy but it is fraudulent.OK, give me a minute or two to get my knots untangled. It was a day off for me and I went  looking for some music we could listen to. I found out that Quinn DeVeaux & The Blue Beat Review would be playing at Cheese board Pizza and they sounded good. Frankly we were not at all familiar with the format here but took it. It is a fixed price menu.  Whatever the pizza of the day  is, that is what you get. You had  better like it because there are no alternatives. It was actually good. Very good. There was a good  selection of beers at $3 and wine at $5 a glass. The wine I  had was the grenache  and was very good. I suppose people come here for the food, not the music. The music was very good. Excellent. I felt sorry for them playing for a bunch of  people not playing any attention. That is excepting one boy, two years old at most, boogieing to beat the band.. It was a treat. The singer got a hold of that,  gri nned and the music ramped up. It would have been a good YouTube video.  In the end,, a decent pizza place (but watch for your change) but not what we went for, to listen to music."
56,I don't get it!  The breads from the cheese board are wonderful but the pizza crust on the popular pizza is tough!  And so overpriced!
57,"A place that is famous to the Gourmet Ghetto, but just because you are famous, doesn't mean you are GOOD. Also they expanded, and expansion comes at a cost. That cost here, is an even bigger drop in quality.I've been going here on and off for years. Mostly it's because people I know want to try it out, not because I recommend it (I never do). When it was a small hole in the wall located next to the flowershop adjacent to the North Shattuck Bank of America, it was decent, for what it is. Now that they have expanded, I find that they have to meet a huge surge in demand every week, and as a result, there is a pretty big variance in the quality of the ""pizza"". And I use quotes because technically......they aren't serving PIZZA. They make and serve CHEESE-BREAD. Stay with me, as I will explain later.So this place expanded, and now has a huge space. But in doing so, they left out a BIG part of the equation having to do with great pizza: they opted to NOT install true pizza ovens, and instead use the same type of bakery ovens used next store at Cheeseboard. The result? Well think about it. These ovens have WIRE RACKS, and as such, the pizzas will never get cooked on the bottom. Sure, they get slightly cooked, but will not get the way a crust should be, as it is not making contact with a flat griddle, only having....the wire rack.What they then do to compensate, is they run each pie, after it comes out of the bread oven, on to a flattop griddle, to then finish cooking it. REALLY? Might it just have been easier (and more proper) to install true pizza ovens in the first place? As a result of this two-step process, I either get ""pizza"" with crust that is not fully cooked on the bottom (awesome), or I get ""pizza"" that is burnt. And this is due not only to the wrong way they go about cooking their pies, but also due to the demand. Since they are trying to feed SO MANY people, they have to crank out these ""pizzas"" as fast as possible, and when you do this, quality always suffers.Now to the definition of PIZZA. Merriam-Webster says the following: a dish made typically of flattened bread dough spread with a savory mixture usually including tomatoes and cheese and often other toppings and baked --called also pizza pieNow sure, it doesn't say here that it HAS to have tomato sauce, but I believe that's because it's a given. Sure, you say there is such a thing as a Venetian white pizza, I get it. But that came about later in the game. Pizza in my world (a world where I grew up surrounded by ITALIAN AMERICANS in the NJ-PHILLY-NY area) always had tomato sauce on it. And this place opts to not use tomato sauce, presumably to keep their profits HIGH. So the result is you get a mixture of cheeses, and some other random ingredients, but never tomato sauce. Which is why I call this cheese bread, and nothing more.Not only that, but it's always vegetarian. You see, since they only make one kind of pie each day, they obviously want to cater to the largest demographic. So by having it be vegetarian, all the Berkeley hippies and picky college kids can eat it. But how about having some salumi on it every so often? They could do something killer with all the locally made charcuterie (salami for the lay person), but instead offer the same 7-10 types of pie over...and over....and over again. This makes for the expected, not the transcendent.And let's face it - this place is making money hand over fist. The product they offer (cheesebread) is not expensive to make, especially when they buy all their cheese in bulk (their cheese shop is right next door), and when they don't buy tomato sauce. So it's just flour for the crust, and cheese, with a few minor additions. They sell pies for $20 (or more now, since now they add tax, whereas before it was included), and will sell hundreds of pies daily. What a racket.It may be historical to this area of North Berkeley, but I'm a REAL PIZZA man, and this place serves CALIFORNIA CHEESEBREAD, and not true pizza. Go here if you must, but just know that in the last few years, many great real pizzerias have sprouted up all over the place. I would patron those other establishments, since they are staying true to tradition. This place? They are navigating according to their own map, and as a result, they serve a product of questionable quality, with no integrity. Is there a line down the street most days of people waiting to eat their pies? Well sure. But all that proves yet again, is that the masses are ignorant. And with most people never having true, East Coast style pizza, I guess that's why they can get away with it.So if you go there, enjoy their faux-pizza, because we don't want you at the pizzeria anyway."
58,"I want to drink the Kool-aid and just adore the Cheese Board's iconic pizza.  It's not the weird flavors, in fact I think the experience of standing in line and getting just one kind of pizza and then eating it out on the grassy median in the middle of traffic on Shattuck is rather interesting and cool, however, the pizza is:GreasyRubberyToughNastyThere.  I said it.  Which is strange, because the Cheese Board makes some of the best pastries ever (especially the scones!  deep yum!)So, just had to toss my review into the ocean of fawning that are the thousands of reviews for this Berkeley institution.  Go there for the experience, not the pizza!"
59,"When I went, the crust was bland, white, flabby, and underdone. I don't want my pizza crust to share the same physical characteristics as Bill O'Reilly, so this didn't appeal to me.The toppings were unique but on the oily side, and I didn't love the corn/cilantro whatever combination they had going on that day. The pizza also came out room temperature, which detracted from the tastiness. All in all, I'd rate the toppings a 3 and the crust a 2. So 2.5 stars overall."
60,"It's all hype. There is no sauce so it's more like bread with cheese than pizza.. and its sooooooooooo GREASY!!! It's like they inject the crust with oil and then pour some on top of the cheese. The crust is heavy and sorta thick and definitely not crunchy (it absorbs the oil). The flavor is good, but would be 10x better with sauce."
61,"I finally bought a  pie last night, I've been hearing about this place for 8 months. As someone who makes their own pizza, I expected that Cheeseboard would at least produce something better than I can make at home. I wasn't expecting the pizza to be anything comparing to NYC, I've never found pizza anywhere in the country that can compare to the the NE, but I was expecting it to be better than what I make at home. The crust was terrible, it was hard and unevenly cooked. The toppings for the night could have been a hit if it weren't for the very metallic aftertaste...I have no idea what it could have been from, I regularly eat pine nuts, spinach, and onions and have never encountered such an off taste on my palate. As others have mentioned, it was very oily. Berkeley is really striking out for me in the food dept., high end and low end."
62,I have always loved this place but after my wife and I fell ill with food poisoning not so sure about this place. My suspicion is the green sauce left on the counter.
63,"This is an example of how the Berkeley herd mentality can benefit a business to an absurd, almost laughable extent. The pizza is terrible by any standard - greasy, weird ingredients, I can understand that as a single-option-per-day operation you have to get creative, but the three times I've eaten here it's been marginal to outright inedible.Cut through the herds of recent vegetarians, Berkeley students (really one and the same, if we're honest,) people blindsided by everyone else's undeserving enthusiasm, and you have a restaurant that deserves little to none of the praise heaped upon it."
64,"The pizza was as stiff a a board, and hard to eat, as if it was day-old: yelp.com/biz_photos/chee…"
65,"Closed on Sunday AND Monday.  Lame.  I have come to rely on competitors that are open 7 days a week and better hours with equally delicious pizza.  Love your pizza, but only when my work schedule allows me to."
66,Too much oil. Greasy with generally soggy crust. Only fresh vegetables saves. The pizza
67,"I really don't get it.  If you like things like raw onions on your pizza maybe this is the place for you.  I lived in this neighborhood for many years and am a big fan of the Cheese Board and their bakery   But I always walk by the lines   and think ""there are SO many better places in the East Bay to get pizza.""  Its not particularly tasty.  Its not particularly healthful (I mean, its pizza).  Why?  Its not worth it even when there is no line. Don't go just because everyone says ""it's great!"".  This is not for everyone and you have to put up with a lot of annoying weekenders while you wait for your slice."
68,"Pizza is good but not great. Like many others I found the staff to be arrogant and indifferent to customer needs. I asked for their famous green sauce and was told,""we only have what's out on the tables."" This was two hours before they close. Bottom line is that there are better places to eat for that price... Especially considering that this is the Bay Area. Also, there are homeless people everywhere outside expecting to get a slice of your pizza or some change. The restaurant not only embraces this crowd, they treat them better than paying customers since they pick up after patrons with the expectation of being tipped as if they are some kind of unofficial employees. This allows the actual employees to spend more time chatting with each other while ignoring customers. Overall, this place is just annoying."
69,I had high expectations for this place but it feel so short. I would have have to agree with some reviewers that it's way too oily and the dough is just too chewy. It felt more like a ciabatta bread then a dough. I spent many napkins just trying to soak up the oil on my Pizza. I like my thin crust like the rustic NY pizza.The only Pro to this place is the atmosphere and the fresh ingredients.
70,"I know Cheese Board is an institution in Berkeley, but I really just don't get it. There's no sauce!! Don't call it pizza if it's not pizza! It was just super greasy and too oily for my taste. Great pizza, like at Pizziaolo for instance, doesn't need to be greasy! Luckily my friend and I came when there was no line, but I  probably would have been more offended by the food if I additionally had to wait in a long line. There was enough seating so we didn't risk our lives by sitting in the median of the road. Overall, I'm glad I tried this place because now I know what it's all about, but it was just NOT GOOD."
71,"This place uses quality ingredients, but unfortunately they seem to use a very limited variety of them. Every pizza I have ever eaten from here which is between 8-12 had pine nuts and feta cheese. I personally love pine nuts, but they do not belong on every pizza with every topping. The feta definitely detracts from the flavor of all the other toppings"
72,"I know this place is beloved, but I don't understand why.  Only one flavor on the menu per day, it's cold, and their combos are alright, but not that special.  Not worth the long wait."
73,"Came to Cheeseboard and ordered the one pizza they were serving that night - cilantro, corn, lime, and feta cheese.  The line was long but moved really fast!  This pizza was delicious.  On with my night, go home go to sleep (mind you, I didn't have anything to drink).  12:30AM - I wake up with violent pains in my stomach and what do you know, food poisoning.  Ugh.  It was brutal. I'll save the details, we all know what its like.  I didn't feel 100% for almost a week. I love pizza and I couldn't eat pizza again for months.  Just thinking about it literally makes me shudder.Worst weekend EVER."
74,"The day my family and I went, the restrooms where nasty and dirty and no toilet paper, the pizza was not that great for the time it took them to,give it to us. The green sauce was kinda icky and sour. I will never come back again. Sorry but I will try another pizza joint out, ps: turn around and go."
75,Beyond over rated. Tombstone frozen pizza tastes better than this. Don't bother eating or waiting for this pizza. Berkeley must have other worth while food. I have nothing more to say but yelp is making me write more to make this post happen.
76,"Pizza that is okay, but highly greasy.Anyone who is actually familiar with pizza will almost immediately call this place out; the crust is shit. There's no way around this point. It's cracker and bread like with almost no chew. They actually brown the crust on the stove, so the oven must be crap. No hole structure in the crust, no actual texture... just shitty pizza crust that one might see at papa johns.The cheese forms a greasy pool of fat on top. The selection of cheese changes so I guess one day it may not be this way.Go for any cheese you may like to see melted; this is not a good pizza."
77,can someone please explain how this place has high ratings? the pizza tastes disgusting! must be the live music and open seating in the middle of the smoggy center divide outside....not for me.
78,"The food is good, but I gotta say that the customer service was rude as hell the last time I was there.I got a super important call on my cell phone when I was in line and instead of politely tolerating the annoying guy on his cellphone (me);  the guy taking my order was an ass about it and a bit self-righteous, pretending he could not hear me when I was pretty darn clear that I was ordering a slice of a pizza.  It was not a complicated order, ""one slice of pizza"".  He actually had that order like 500 times that day.... and they only have one type of pizza.  But in order to make some kind of personal point, he had to go out of his way and pretend he could not hear what I was saying because I had a cell phone in my hand.  [FOR SEVERAL MINUTES HE WAS RUDE].  Perhaps the self-righteous hipster stink-eye would have been fine, but he made a whole scene!  So, food, good.  Self-righteousness and rudeness was over the top.  It kinda made me not notice the taste of the pizza.But then again, I hate the guy with the cell phone too.... (this time it was me).And as much as I hate the cell-phone guy, I gotta say, I hate the self-righteous person across the counter who pretends they can't hear in order to make a point even more.Even though I was partially in the wrong (being on a cell phone), the dude totally ruined my food experience of otherwise decent pizza.I woulda rated this experience a 1, but gotta admit, I was on my cell, so I'm giving it a 2."
79,"I don't see what the fuss is about. These flat breads (please don't call them pizza) are mediocre. I only went once so I can't comment on the different toppings they offer from day to day (other than to go say that the one option, no menu thing is a gimmick), but flatness and pizza are all about the crust for me, and this one was disappointing. Overuse of oil was one problem. Worse, however, was how underdeveloped it was, with large cavities and an insufficient rise, leading to a texture that was dense and uneven. I enjoy both thin, hard crusts and toothsome, airy crusts, but this is the worst of both worlds. The cheese they use is excellent of course, and I imagine they come up with some amazing topping combinations, but their baking needs work. As a side note, I found the same problems in their yeast risen baked goods next store,  seemingly symptomatic of rushing the product, probably with too much yeast and not enough rise time, although other factors might be in play. Overall, this is not much better than a novice could make at home."
80,"What is up with the hype with this place? When I went to Cal, i was never a fan of this pizza place. The pizza is like vegetarian style pizza with only cheese flavor. I rather eat Costco Combo pizza if you ask me."
81,"My sister was raving about this place and how it features a pizza of the day, so I was looking forward to trying it. The wait in line wasn't too bad, but seeing the amount of people there I thought it was a good sign. We ordered two pizzas and a large salad and sat at the middle divider where I guess it's a tradition to do so.I started on the salad first and I thought it was pretty good, nothing out of the ordinary. Then I ate a slice of pizza and thought it was good as well. It definitely didn't satisfy my expectations of all the hype, so I would've given it a 3 (I wasn't overwhelmed by the customer service either since our cashier was a little rude). I started eating the salad again, and to my GREAT disgust, found a yellow beetle-looking bug with black spots on it. It definitely hadn't fallen in the salad during the time I ate it because it looked like it had been dead for a while. After that I completely lost my appetite, and had to give it a poor review. I'm sure it doesn't happen often and that I just happened to get the bad salad, but it's still pretty gross."
82,I usually LOVE this place but have to give it a shitty review for the shitty service I got today. I merely wanted a freakin' box to carry my three slices of pizza and the guy gave me a lecture about how they are trying to save the forest for our children. WTF.  Pizza tasted good though.
83,I really have no idea why people line up for this stuff.  Their crust and pizza are really second-rate.  Gioia near Monterey Market is far superior.
84,"I generally really, really love pizza. I just don't understand why everyone loves the pizza here. There are so many other places around that are better- less greasy and with better flavors. I'm more confused than disappointed because of how highly it's rated!"
85,"WAY overpriced.  Doesn't even taste that good.. it's really greasy sometimes.   Not worth the hype.  Zachary's is a million times better.Also, no meat.  WHAT?  HELLO? MOST OF AMERICA ISN'T VEGETARIAN HIPPIES."
86,"I've heard about this place so much that I expected the pizza to be one of the New World Wonders.You get there on a Saturday noon, and the long line does nothing but strengthen the expectation.They were serving only one kind of pizza which helps the line move very fast. This is great. The volume of pizza they were moving also means that what you get is freshly out of the over, which *should have* made the pizza even better.But it just... wasn't... good.The pizza is very greasy, the cheese on it is good, it barely had any tomato sauce, and the crust was hard - not crunchy - like stale bread. My heart was broken."
87,"For $5.00 I got two completely charred (I took pix) wedges of pizza. Even if not burnt, the crust was thin and boring, none of the texture or flavor one would expect of, um, a bakery. The Roma tomatoes were cooked within an inch of their lives, so that left $2.50-worth of cheese and $2.50-worth of flavored oil.Hey, just down the road in Oakland, Arizmendi Bakery will deliver cheese, oil and more toppings on a real yeast-risen crust with one-quarter of the wait and attitude. Plus - no annoying UC students droning on and on about how standing in line is, like, bourgeois and sheep-like but actually totally worth it because my roommate's cousin's girlfriend who is actually a local, like from here, swears that this is, like, the awesomest pizza ever, and like, she oughtta know. Shut up!"
88,"I don't get the hype. This pizza is mediocre. Not terrible, not great. Sure the ingredients are fresh and unique but that's not enough to warrant these kinds of reviews or a line out the door. I've had a couple different types of pizza from here and it's always been just okay. Sometimes, the crust tastes like oily cardboard. Apparently they don't use real pizza ovens so the lack of a crisp and delicious crust makes sense. I love love love thin crust pizza, east coast style and this is a sad attempt at best. Save yourself a few bucks and make your own thin crust pizza at home in your oven and it'll probably be just as good with real, fresh ingredients..."
89,"Today's pizza: Fresh zucchini, onions, feta and mozzarella cheeses, topped with basil pesto. (PINENUTS in basil pesto). They only have one type of pizza a day, and it's all vegetarian, which I don't mind at all. So we decided to come here to get a whole pizza ($20) before the Big Game and bring it back to the apartment to chow down. The line wasn't too bad at all, and parking was easy to find. I expected a lot from Cheeseboard, as this was my first time there! Everyone always raves about how great it is. But when I got home and had my first bite, I was a little disappointed. I mean, don't get me wrong, it was good, but it wasn't GREAT. But supposedly their corn pizza is amazing, so I might change my review once I try that. The two stars is for the fact that I was disappointed, and I've had better pizza than this, and it's definitely not the cheapest either."
