,review_text
0,"Oily, oily, grease! Super overrated- will not be back! I have gone here twice and know it was not simply ""just a bad slice."" The pizza is so greasy, it's hardly edible in my opinion. There is thick layer of grease on top and bottom of the slice. I wiped off as much as I could until I ran out of napkins. If that's what 4000+ reviews on Yelp enjoy, I won't stand in your way- Enjoy. I, for one, and my BF who agreed, will not be joining you again."
1,Of course it's a classic but lately egh! How many ingredients can you cram on one pizza. Stranger combinations doesn't mean better tasting. And they hand you the towel when you ask for a clean table so you can wipe it yourself. I know it's a collective but last time I checked I wasn't getting a cut of the profits. WipeYour own damn table.
2,"Yesterday was my first time trying Cheese Board Pizza because I saw all the wonderful reviews. I have to say that the pizza was delicious and loved the crunch of the bread. I ordered a whole pizza so that I could have leftovers for dinner. My whole perspective changed once I took a bite of my pizza (did not microwave) and found a long piece of hair stuck in the cheese. I was quite disappointed and disgusted at the same time. Sadly, I will not be coming back."
3,"Overpromised, underdelivered. Disappointing. Expensive pizza with a long line of cult bigots. Tastes just like any other pizza on a regular day, on a bad day it has weird toppings that just scream ""pretentious"". Usually closed during off-work hours."
4,"The pizza was advertised as having tomato sauce. It had none. I understand this place is generally sauceless, but you can't say the pizza of the day will have ""tomato sauce"" and then not put any in the pizza. I don't think this place serves ""pizza"", but rather, a ""cheese bread"", as most people know the definition of pizza to have tomato sauce.They have their own ""omitting sauce"" pizza style and that's totally cool, but please don't advertise the pizza as having tomato sauce and put none. That is uncool.The sauceless pizza we had was no doubt, still pretty good. This rating is for the lieee. I come to a pizzeria craving that tang and tart of the tomato sauce. Also, no ranch? Your ""pizza"" is a cheesy garlic bread/flatbread. Some tasty buttermilk ranch is necessary in that case! What's up with thattt."
5,"I had very high expectations for this place since it was recently voted as America's finest pizza. Outdoing Chicago and New York (surprisingly). Perhaps I came at the wrong day and time but the pizza was very basic to say the least. The only that that made it edible was the fact that I accidentally poured the entire chili flakes onto the pizza (someone had apparently not screwed on the cap tightly and it came off as I was using it) and dipped it in the pesto salsa. The pizza toppings that day were: cremini, oysters, mushroom, mozzarella, baby dino kale, caramelized onions, parsley, oregano, garlic olive oil, and cave aged gruyere. I saw and tasted one oyster in the entire pizza (bought an entire box). It was very disappointing. In addition, the pizza was hard and very uncomfortable to chew. The pizza seemed to be old (from earlier that morning) since I came during the second opening (4:30-close) and that they had just reheated it in the oven. The crust was so hard that I had to throw all of it away and I usually love the crust. Cheeseboard reminds me a lot of Sliver which I find is a lot better than Cheeseboard. They have lunch specials, a bar, and a lot more seating inside and outside. Cheeseboard is so overrated. Plus, they're closed on Mondays in addition to many other restaurants in the Bay Area and that completely bugs since people still ho out to eat on Mondays. However, the pesto salsa is beyond AMAZING and I'll probably come back just to buy some for home."
6,Over rated pizza. There are plenty of places in Berkeley where people can eat a better pizza.Cheeseboard Pizza didn't impress me at all with the quality but what really bothered me has been the lack of attention to the customer. I would say definitely rude. I would have given 2 stars for the pizza and zero for the experience at the table. So I came up with an average of one. Won't be back anymore and my friends too.....
7,"After living in Berkeley for so long, I was excited to finally try the Cheeseboard that everyone talks so much about. Maybe my expectations were too high coming in, but I thought the pizza was way overrated. Today, the daily special was the asparagus, mushroom, and mozzarella pizza. When my pizza arrived, I noticed that it looked just like the pizza at Sliver would look like. After taking a couple of bites, I noticed how bland, cold, and rubbery the pizza was. Now that's significant coming from me because I'm the kind of person who is normally not into strong, salty flavors. However, Cheeseboard's green cilantro sauce was very tasty (the one thing that's better than Sliver's)  and helped balance out the bland pizza. Cheeseboard was an interesting experience. It wasn't terrible, but it didn't make me want to come back for more."
8,"For a 4.5-star Yelp reviewed restaurant, Cheese Board Pizza was disappointing to say the least.  If someone were to blindfold me and had me eat a slice for this restaurant, I would have said it was OK but it wasn't my favorite.  To learn that this is MOST reviewed establishment in Berkeley with a 4.5-star rating on Yelp is baffling to me.A slice of pizza from Cheese Board resembles closely to a cheese stick but with less cheese.  The cheese is essentially burnt on, which makes the slice crispy and hard, and the toppings are sparse and underwhelming.  I found the pizza to be really oily too.  Cheese Board is all hype and maybe a favorite with many UCB Yelpers because of its proximity to the campus.Despite the long line, it moves fast because they only serve one type of pizza each day.  In other words, you'll get your pizza handed to you before you even finish your transaction at the register.  It costs $11 for half a pizza and $22 for a full pizza.  Maybe the rave reviews are from those who think the prices aren't that high but the pizza was seriously underwhelming and I doubt I'll ever return again."
9,"Meh, maybe I'm just a snob when it comes to pizza but this is just... okay. Every time I've gone there and tried the different slices of pizza they have everything is always oily and over saturated with moisture. The topics are usually average in quantity but most of the time I've had a single piece of potato on the top of a slice and thats it. I don't know, I'd take Zachary's over this any day of the week. That's the true Pizza spot of the East Bay in my opinion."
10,"I spent $70.00 on two pizzas, 2 TINY glasses of wine and 2 salads.The live music was awesome and the place was crowded but not overwhelming. Just enough to make it seem like an excellent restaurant. I suppose it is and that's why all the people were there. The service was good. The people were nice. But that pizza... it was greasier than Domino's with a very special think crust that I wouldn't order again. It greased through the bottom of the box. The bottom of the pizza did. I gave that pizza away to a nice homeless man who was drinking left over booze from the bottles in the trash out side.  I wont be coming back. It was loud and no one cleaned up after themselves. We had to move trash off our table to sit down. All the tables were the same thing. Expensive, too greasy, and the Berkeley crowd can't figure out how to clean up. No thanks."
11,"overrated and overpriced rabbit food.  It's the food equivalent of the playa experience at burning man.  Countless sheep will recount how it changed their lives when they haven't seen, tasted, or experienced true magic.I'd recommend Rotten City but apparently a pizza is $30+ there now.  The bay area just sucks."
12,"If Cheese Board Pizza was an NBA basketball player, it would be DeAndre Jordan: all flash, totally overrated.Sure, it's got the unique business model and the chill atmosphere. But at the end of the day, if the pizza tastes average, nothing else really matters. The pizza at Cheeseboard was oily and bland. If I wanted that, I would've gone to Seniore's. I just don't see the hype."
13,I'm sorry I don't see what all the hype is about cheese board pizza!! The pizza dough texture is a combination of rubber & cardboard.They also put red onion on ever pizza they make !! I've had the salad and it was good but nothing that memorable.
14,"Four stars for greasy pizza is overrated. The Ingredients look and taste fresh, but the pizza it's just too greasy for me. I do not think is worth to come from far to try this pizza."
15,Not worth it. The pizza was overcooked and had such a hard crust. I decided to throw more than a half of the pizza. The green sauce was alright but not great. I will never go again.
16,what i ordered... pizza of the day (Saturday)I don't know what's the big fuss about this place...  line was so long just to get  a so-so slice of pizza or maybe because i was the only one who lined up for the taste of the food and not for the establishment's berkeley aura.pizza tasted ok but the crust was hard and oilyambiance... good (a very loud live band playing inside and some table and chairs outside to gobble your food if you can find an empty one)service... so-so (i guess because there's so many customer's in line to handle)cost... $ (fair)
17,"The atmosphere is great - I really love the live music and outdoor seating. But the pizza is so-so, especially when you consider how long you have to wait in line to get it."
18,"I don't get the hype. I don't like the thin crust, and I also don't like their flavor combos. I like being able to choose my toppings. This goes against what tons of other people think, but really just not a fan. Not worth lining up for."
19,"Another case of the urban myth surpassing the reality. Not worth it. Go to their bakery next door instead and grab a loaf of the curry bread, or something else interesting. But don't get sucked into the hype of this place."
20,"It finally happened:  I visited a 4.5 star average rating restaurant and didn't love it.  I see the draw of this place, but the sheer volume of grease on the pizza was just too much for me.  We used a giant stack of napkins to soak it all up and there was still oil dripping from the slices as we ate.  I felt gross sitting there looking at the greasy pizza box while we ate.  The flavor was good, but the grease was NOT my style at all."
21,"You can read all about how unique a pizzeria Cheese Board is in other reviews, but although I've visited twice, I don't plan on returning again soon. Sure it's vegetarian, but you can get a veggie pie damn near anywhere. Cheese Board is unique in that it is employee owned and operated.The first time I went there, the pizza was ok but was made with lemon zest, which overwhelmed all of the other ingredients on the pie. It was also incredibly oily.A few weeks later, I had friends visiting and I wanted to give Cheese Board a second chance because I had faith in communal wisdom. We had the Fall Delight: Butternut squash, parsnip, baby kale, mozzarella, gruyere cheese, balsamic reduction, breadcrumbs, and fresh herbs. Again, the crust was chewy, the pizza was VERY oily, and the flavors clashed. We purchased 2 whole pies, but my friends had 1 slice each before turning it away in disgust, leaving me with a pie and a half to dispose of.I will not be coming back."
22,Been going to The Cheesboard for years.  Went last week - shocked to see the price of a pizza increased 20% to $24!!  That is very very expensive for a veggie pizza.  Just be forewarned on the price increase.  I wasn't and was shocked when I saw the price.  Crazy!
23,People think McDonalds is amazing too.I can't believe that this place was voted #2 in Yelp.. it is okay..
24,"Wayyyy too cheesy. You can't taste any other ingredient. Doesn't matter that they use fresh vegetables because all you taste is the cheese. Hold off on so much cheese, Cheese Board."
25,Cheese  w/ sliced Tomoato on a usual pizza..good.. but this one was bombarded with cilantro and covered with lemon zest...I understand that this place is deigned towards vegans..But whoever designed that particular topping combo must've been trying a little too hard with contradicting flavors/tastes.... kinda like mixing perrier  sparkling water and Coca Cola...They've got better toppings to offer on other days.. but this one just blew...I should have know  why the line was shorter than usual..
26,"Sorry to have to say this; but they are going down- hill on their pizza; too much cheese and definitely swimming in oil; I always order mine""no oil please"" and it is still swimming in oil; I must be the only one in Berkeley who finds the pizza no good; I love the music, the ambience, and the staff; but they need to revamp the pizzas as I have suggested above.. I now have only salad and wine there; last time I threw the pizza out.  Sorry my friends."
27,"food excellent, almost all staff cordial, helpful... i often buy coffee, sit out ,enjoy it with a sweet something....  since store has no microwave ( you really should) i sometimes ask for a tad more coffee to get it warm in absence of the micro... almost always, i am cordially given a bit more coffee, no cost.....but there is one asian woman at register who needs attitude fix.... she is on automatic for all purchases and when asked for a tad more coffee says ""we charge for that"".... and turns away....does not make for an enjoyable few minutes with my coffee and a purchased treat.....nor does she make paying for any other purchases pleasant either....i know the store has as much business as it can handle but really, have your manager ponder this particular employees customer relation skills....she is the employee likely to say that if she gives me a tad more coffee- at no charge- she will have to do that for everyone...i have seen that stance before and it does not serve the business...."
28,"OVER RATED & NOT IMPRESSED.CHEESE BOARD PIZZA HAS ONLY ONE TYPE OF PIZZA PER DAY, IT CHANGES EVERYDAY, AND ITS ALWAYS MEATLESS! MEATLESS?! I AIN'T NO VEGETARIAN!!!Keeping this to the point, since I know many people don't have the patience to read PhD dissertation writing styled reviews either. PROS:-- Unique combination of of vegetables and tubers that go into this pizza (today it was: potatoes, lemon zest, beets, cheese, parsley, tofu, black pepper, green onions and zucchini.) -- Vegan/Vegetarian friendly-- Live band was entertaining the crowd while patrons enjoyed their pizza.CONS:-- PARKING FXXKN SUCKS!!! Unless you are feeling lucky?-- Ridiculously long lines (which wasn't too bad)-- Only one type of pizza per day, which are geared for vegans/vegetarians.-- Some parts of the pizza were cold.-- Too greasy and extremely salty. -- Too many hipsters and band wagoners. SERVICE:Quick, but Mediocre. Meh.OVERALL EXPERIENCE:I stopped by for pizza since I was starving and ate a whole pizza. Unfortunately, the pizza was not filling, and I ended up going to one of many commercial pizza shops in the area to fulfill my pizza cravings. While the ingredients in the pizza were definitely a unique combination, Cheese Board Pizza lacked flavor. The only thing I was able to taste was the extremely salty Mozzarella cheese, some hints of lemon zest and crushed black pepper, BUT THAT'S IT. As hyped up as this place may be, I wasn't very excited about it when I took my first bite of heart attack greasiness. This was my first time eating at Cheese Board Pizza, but will be avoiding it from now on. Perhaps I'll return to update my review in 5 years?"
29,"It was my first time here. I came right when they opened and there was a long line already. That day they were serving garlic corn pizza. To be honest, I was not impressed at all.  The crust was overcooked and burned. There wasn't enough garlic flavor and not enough corn. The dough was not flavorful either.  Service was great though. They have a live band and outdoor seating.  Overall, Arzimendi in Oakland is a lot better. I don't think I am coming back."
30,"As a New York lady, I have to say I'm gravely disappointed by cheese board. IMHO, this just is *not* pizza. Try Artichoke's on Durant for some real pizza."
31,Pizza was meh. Not worth the hype or the long line. I feel like everyone is raving about the green sauce which is really good but pretty much just Aji Verde.
32,"No doubt, Cheese Board Pizza is an institution in Berkeley on a Saturday at lunch.  But the pizza?  I get the sense that it is made the day before.  It feels a bit stale to me on the occasions that I've gone.  The ambiance is lovely where they have some of great live music.  But the actual pizza?  Well, that's what they are there for, and it's sort of stale."
33,"I don't get the hype on this place. I work around the corner and see a line out the door and down the block every night, but I've never been much impressed. Their pizza is more like greasy cheese toast pie, and when you put the pesto sauce on it, all their pizzas end up tasting the same.There must be something in it that really gets other people's bones a-jonesin' but it just doesn't do it for me. Maybe it's the east coaster in me, or maybe I lack the sufficient tastebuds to taste the refined and nuanced flavors of Cheeseboard pizza, but I'd say it doesn't live up to the fame.Their scones and cheese shop next door is AMAZING though, definitely would check that out!"
34,"After seeing Cheese Board pizza rate so high with the Yelp review (2nd in the nation!) I simply had to see for myself.  Yes, there was a long line of followers waiting for the doors to open.  Yes, the folks in the line were very excited about the pizza being offered today.  Yes, we were hungry!  The pizza was mediocre, and now 3 hours later I have heartburn.  I'll go with a Costco pizza any day over a Cheese Board, and at half the price (Costco $10, Cheese Board $20), but what the hey, it wasn't bad pizza and we did have enough left over for my daughter and grandson to enjoy."
35,"I gave 2 stars for effort, but we did not like the 'pizza.' We came from out of town and seen the madness over this place so we had to check it. It's not pizza, it's flat pita bread with a ton of cheese and pesto!! That's all you taste is the heavy toppings. We were disappointed even more so when the digesting process began! No thank you!"
36,"To expensive, not proven that it is organic, to long lines and just a few tables you can sit on. The Pizza was ok but I would not say it is the best I have ever eaten."
37,"Cheese Board pizza is too rich for my tastes in more ways than one. Gives me indigestion of the stomach as well as the wallet. Sorry, I am not a fan."
38,"When my sister and I were in NYC earlier this summer, we went to Grimaldi's in Brooklyn which was one of the highest ranked pizza places on Yelp. We weren't sure if the pizza would live up to the hype, but it really did. It was fantastic! All of the elements on the pizza were in perfect harmony. Some times, things really are as good as you imagine them to be. Unfortunately, Cheese Board pizza is not one of those things.Cheese Board is definitely one of the highest ranked pizza places around these parts. However, in my opinion, it does not live up to the hype. They do things differently, but being unique isn't the same thing as being great (in spite of what a lot of people in Berkeley seem to think; I'm looking at you, guy-I-saw-on-Shattuck-walking-around-with-no-shirt-on-with-a-septum-piercing-connected-to-his-two-nipple-piercings-by-gold-chains-to-form-a-weird-triangle).The vegetables on the pizzas are certainly great, and the cheese tastes amazing. If they stopped there, the pizza would be light and flavorful. However, they always proceed to drench it in garlic olive oil. This makes it heavy and oily; Too much so for my taste. It just detracts from what would have been a very good pizza.The restaurant definitely has a cool atmosphere. However, the pizza is too oily, so I have to say that this place is overrated."
39,Worse pizza I ever had in my life really disappointed I was looking forward to try it I'll never repeat it it was like deep fired pizza I was squeezing  it before eating to take the oil out it turn my stomach inside out worse pizza ever I do not know how the people stay in line for hours to eat this kind of pizza buy frozen one it taste much better I wish I can put minus 5 stars
40,"I'm a pizza snob, and this place is so over-ate-it. I was excited to try this joint because of all the raving reviews so I mindlessly ordered the giant box for $21. I didn't dislike the Cilantro/Spinach/Mushroomy pizza but I'm just not a fan of all-vegetarian pizzas. Taking meat away from my pizza is like taking away a color from a rainbow. No bueno!Bottom line, I never had a pizza I didn't enjoy. But, I will never come back again. The loud music was...so loud I had to strain to hear my cashier. Instead of those cellos, more tables and chairs would help the restaurant's efficiency. Finally, this location attracts a lot of the city's finest weirdos so that's my 2 cents whether you want it or not. I wish I had a better experience :( I really wanted to like this place."
41,"So disappointed! I've been wanting to try this place for a while due to the great reviews, but when I finally tried it last week, it was very underwhelming. The flavor of the day was pear, walnut, and blue cheese. The flavors didn't really come together, and it more or less tasted like bland cheese pizza. I was not a fan of the cilantro dressing for the salad either. Just tastes like...oil. Maybe I just came on a day with an iffy flavor (also don't love the fact that you're stuck with the flavor of the day), but the most important part of a pizza is the crust, and I didn't think the crust at Cheese Board was anything special either.Glad I tried it, but will have to chalk this one up to hype."
42,Great food.  Horrible parking and service not so good.  Food was not worth the hassle.  Won't come here again.
43,"I've tried twice now, because of the reputationbut my conclusion is clearit is far tooooo greasyeach pizza is literally dripping with oilI've experienced that before only with french fries in a Five GuysI can't go back to that place"
44,"Go once for the atmosphere, experience it, forget about it.They claim to have a different pizza everyday, but they really only have one kind: girl oil pizza!Unless you are a garlic lover, stay away."
45,"being from NY I know what pizza should be. their pizza while better than the chains. it only good, no way no how they are 5 stars that is from people that don't know pizza"
46,"If you are from NY this pizza by the slice sucks not worth the line stay away , place is nice with live music"
47,"This place offers ONE type of pizza per day, and you do not have a choice in toppings.  The crust is not crispy, nor chewy, and if you order a whole pizza, it may not even be hot.  I do not understand the hype for this place - people wait in a long-ass line, for mediocre-at-best pizza, and don't even get a seat in a restaurant - I saw 3 groups of people eating on the center median lawn divider of the street, next to a sign saying do not block median.  We ended up eating the lukewarm pizza in our car, which was parked a few feet away from the ""restaurant"".  For fantastic pizza, I could understand - but, this place has far from fantastic pizza.  I could overlook not being able to choose toppings if the crust was delicious - crispy with a chewy center and flavorful, but IT WAS NOT any of those things.  I would not go back."
48,"Over-rated and over-oiled.They never use marinara and you have to sit on the filthy ground while you eat because they don't offer enough tables to their customers. Also, the pizza is often cold. Honestly, these are requirements #1, #2, and #3 for a pizza joint.The two things which work to their advantage is that they always have long lines and they choose your food for you. Berkeley denizens love these things because they make the experience more prestigious.Avoid the potato pizza, which they seem to offer every time I go there."
49,"so take this review with a grain of salt.  I think if you want to walk in and get a pie or a slice- you will have no complaints.  The long lines move fast and their pizzas are good.  I ordered 8 plain pies and 3 specials in advance.  Called again to confirm the order.  When I arrive - they have done nothing and aren't even up front with me about having completely botched things.  When they  finally accept their mistake they were very apologetic - gave me extra pies etc.  However, I had to wait an extra hour - when I expected to waltz in and be able to pick them up. Its not like they comp'd me 3 pies- they gave me 3 extra pies on top of what I ordered.  I don't need 3 extra pies of pizza!    Also - to add to the negative experience- they didn't even make my order correctly.  They were supposed to be 1/2 baked - and they weren't.  I will not use them again for a party- but if I was in the neighborhood- I would go in with just my family.."
50,"Good GOD - the lines here are WAAAAAAAAY to long!!!! I mean, it's pizza. Yes, it's good... but really? Is it wait-in-line-for-45-mintues good? Me thinks not. At least they provide entertainment (Jazz trio, ok!) for you to enjoy while you wait in line... but still."
51,"Not sure what the big deal is about this place.  The pizza sounded good on the menu board - summer squash with aged Asiago and basil pesto but just a pile of blend, greasy, cheesy bread.  I waited in a huge line for a pizza I couldn't wait to throw away.  The ambience and service were great.  Would never recommend the pizza based on what I tasted today."
