,review_text
38,"I ordered the spinach and tofu curry dish (Tofu Saag) and was incredibly disappointed. They basically gave me a bowl of spinach. There was so much spinach. Too much.  The tofu was fine, but the curry was too watery. It was not what I expected. The portions (despite the abundance of spinach) were so small for such high prices.Disregarding the food, service was fine and the atmosphere was inviting."
39,"Came here last night to try it out, website seemed promising. My veggie pakoras seemed to be 90% onions and they charged me $2.95 for mongo chutney. I get the feeling this restaurant is more about saving money than anything as the portions were so small it was sad. It's really pricey, I won't be coming back. The dish I had was good but $12 for a little bowl of it is just too much. With a restaurant that does reservations, one would think they would make enough money to actually serve a good amount of food. I still can't believe they charged me for the chutney."
40,"I made the mistake of going back to this place a second time because of a Living Social deal.  Never again.  Yes, the lentil soup, mango lassi, and garlic naan were good.  But the Lamb Vindaloo was bad, it was tasteless, stringy, and totally bland.  The Shrimp Palek was also bland and tasteless.  By contrast, House of Curries is a much better deal.  Good food, well seasoned, and cheaper.  Hard for me to believe that Yelp has a 4 Star review on this."
41,"Great food. However the service was ridiculously bad. We came in and got seated right away, however, had to wait like 20 min for our order to be taken. Once we ordered, ONE MINUTE later we asked if we can change one of the entrees. The waiter first asked me which entree I wanted to change and after I showed it to him on the menu, he looked at me and said that I would have to pay for both if I wanted to do that! Really now? Never encountered such bad service. Never going there again"
42,"I bought a Groupon thinking ""wow what a great deal - $10 for $20 of food!"" That was my first mistake. The food here is not only average to below average but it is incredibly EXPENSIVE for Nepalese food in Berkeley. My friend and I went for lunch and shared two dishes and an order of naan -- and walked out of there with a $40 bill!!! The only positive thing I can say is that the fresh naan was tasty -- but not worth $4 an order. C'mon!I will never go back there. I felt totally ripped off and if I hadn't been so hungry when we arrived I would've walked straight out when I saw the prices. Very disappointing.Don't ever buy a Groupon for this restaurant and do yourself and your waller a favor by going to a less expensive restaurant with a lunch buffet."
43,"i've had so many bad experiences here it was time to write a review. this place is so inconsistent. sometimes it'll be okay and other times it'll be horrible. i will not be back due to the poor quality of my last experience. we went there with a party of 6 and every single person got sick from it. all six of us were left with crippling stomach cramps and throwing up from this food.if you go here, prepare to get sick!"
44,"This was one of the worst Indian restaurants I've eaten at in quite some time. I knew I was in trouble when they brought out a complimentary lentil soup that was cold and tasted like dirty dish water. My friend said her chicken curry dish was awful and the chicken tasted off. My lamb tikka masala was actually ok but I knew there must have been a lot of MSG in there since I was mega thirsty. The naan was ""poofy"" like bread you would find at Applebees and not flat like most indian places. I felt like I was robbed after I paid the bill. How this place has all these high ratings is a mystery."
45,"I had a groupon so I went to check this place out.  First off,  its flippen hot inside and none of the floor to ceiling windows are open.   The food was very ordinary and over priced.   Nothing had much flavor even though I asked for spicy hot.   I had to pour on the salt.  The naan was nice and fluffy.  Note to self:  pass."
46,"We've eaten here a handful of times and I would put this place squarely at middle of the list of Indian restaurants in Berkeley - decent but nothing to write home about.  Definitely better options in this area.  However...We ordered delivery via Eat24 and it was absolutely terrible.  Zero flavor in any dish and vegetables tasted like they were straight out of the freezer, papadam were clearly undercooked and completely inedible.  Might have been the worst Indian food I've had in Berkeley.  averaging out to 2 stars hoping that our last terrible experience was simply due to being takeout..."
47,"Ordered the variety momo platter with friends -- the dough was hard yet tacky on most of them, like they'd been sitting out awhile. No thanks. Our waitress was lovely, and our entrees were mostly good, though avoid the brown rice: tasted like boil-in-the-bag. My groupon was handled by a weirdly aggressive guy at the end of the meal, too, since apparently you can't have the free yelp check-in dessert in the same order (where does it say that?). Too pricey for what I got. Won't be back."
48,"I have been to Nepal when I was a child but don't remember the food and have been meaning to try this place out for a long time. Unfortunately, Just couldn't feel this place and don't understand the raving reviews.Everything was just average or below. I am not going to hold the parking hassle against this place. The ambiance was just OK. Service was just OK, the food did not come out in the right order and took a long time. The food itself...was just OK too. The quantity was small and the food was a good 30% overpriced IMHO."
49,"I got a Groupon for this place so thought we'd check it out. Honestly, I would not cart my butt through traffic again to go eat at this place. We had the tandoor mix plate, chicken momo (dumplings), and aloo matar (which is supposed to be snow peas with potato in a tomato base) with coconut naan. The first dish was the momo, which I thought were just average. I didn't see any reason I would want them again, since they were just not that special. The sauce that they came with was also on the bland side. The yellow lentil soup was the most delicious dish, and that was a surprise, because we did not order it (it came with the tandoor platter). The coconut naan, while tasty, was more like a dessert- had more leavening then I'm used to in naan, so was a bit cake-like. Delicious, but not really complimentary to what we ordered. The aloo matar was simply not what they said it was. There was not a fresh pea nor a snow pea in the entire dish; only frozen peas, which makes sense this time of year, but they need to be honest about it up front, because there is no mistaking frozen peas for snow peas. The temperature of both the matar and the rice was so low as to be a bit suspect. The tandoor plate was just okay. The chicken was good, but average. The prawns on the plate tasted overcooked, bland and frankly, not fresh. The lamb was horrific. I could not slice through it with my knife, period. When I was able to gnaw just a bit off the end of a piece, it tasted like mutton, not lamb. It was tough, extremely gamey and impossible to eat. I brought it home for my dogs, who I thought would appreciate it much more. The service was good, but a bit stiff. The dude sitting in the back checking everyone out is a bit unnerving. Also, I thought the prices were too high for the quality. Without the groupon our bill came to almost $50.00. I can get a REALLY good meal in the Bay Area for $25.00 a plate, so why would I come back?"
50,"Oh my gosh, I really wanted to like this place and was so exited to try it after all the great reviews I read and after my brother recommended this place but i was very disappointed and shocked!! it was a nice ambience but my reviews are always about the FOOD because that is what I am paying for!I love love indian food and believe me, I know my indian food! Maybe the cook was having a bad day but I just thought this this is not the best I have ever had! My family came here for my brother's graduation lunch (congrats brother for graduating from uc berkeley). there were 8 of us there! and i had no idea it was so expensive and the portions were so small. we dropped over $100 on this meal and you'll be shocked to see what was on our table.we ordered 5 entrees that were little ""this big"" -  the size of a small cereal bowl, seriously!  we asked the waitress to give us an idea of what we should order since we didnt know how big or small the portions where. so recommended 5 and that is what we went with. all and all, i'm giving this place only one star because the portions were small, the flavor was not anything specular, even the tiki masala was not the best i have had. again, only a few pieces of chicken. the curry fried rice also wasn't great, no flavor. i seriously starved all morning waiting for this place but i was so disappointed!  i didn't get any lamb because my brother said there was like 3 cubes in there. its not like we left hungry but it didnt satisfy my indian food craving and i felt like i overpaid. i have never had bad indian food but again, NOTHING SPECTACULAR HERE. if anything, i would say it is just average tasting indian food. i am also comparing this to INDIA OVEN in Sacramento, which is an all you can eat, indian food buffet, where the food is AMAZING!  the have fried naan! seriously, dont let the word buffet fool you here.   you can eat as much as you want, the food is prepared very nicely, not cheap at all and the restaurant is very nicely decorated inside. its not what you would picture a ""buffet"" to look like."
51,"I'm really surprised at the positive reviews of this restaurant. So many better places in Berkeley to choose from. I mean, sorry Ben. W., ""Utterly splendid""? and ""at a price that doesn't break the bank""? Well, maybe I had two of the worst menu items. The chicken tikka tandoori was incredibly bland and was overpriced at $18.95. The bed of veggies is was on were equally bland and undercooked. Usually on those sizzling plates that they put the tandoori on, the onions and peppers are nice and caramelized. Not in this case. The chicken was tender though. But it was just a breast on boring veggies, again for $18.95. The other dish I got was tofu saag. This isn't your typical indian saag where the spinach is finely chopped. It's whole leaves of spinach in a very bland sauce with chunks of tofu, all serve in a small bowl for $11.95. Ridiculous. Made me wish I had gone to Ajanta instead. To top it off, the service was so slow. They half cleared our samosa plates, forgot to bring us larger plates when the dishes showed up, and the staff all seemed like they just woke up from a long nap. On a positive note, the samosas were good and were only $3.50 for two. The atmosphere is nice as well."
52,"Eh, it was fine.  It was mostly Indian Food which seems a little like false adverstising.  The momos were good though."
53,"We had an absolutely horrible experience here. No one cared and we tried to get *any* waiters attention but no one made eye contact. We had to specifically ask for glasses of water, and they never refilled it. The waiter came a total of 3 times - once to get the order, once to bring the food, and once for the check. The mango lassi was bad. The milk was old and it tasted acidic. We asked for a fresh one, but they said they had it pre-mixed so they couldnt make a new one.We ordered medium spicy food, but we instead got quite spicy instead. Imagine ordering a 4 and getting an 8. Even the naan here was weird - not soft and it felt like it was made with cheese even though we ordered plain naans.In summary, dont trust yelp reviews on this place ahahahaha. We went here thinking we would get amazing indian food. But no, we got this horrible experience and not-so-great food. I'm Indian, and I know what a freaking 'mild' spiced curry tastes like. So there you have it!"
54,Short review: The Momo (potstickers) appetizers were pretty good and one of the better ones around but I miss the usual chilli-pepper sauce. I also liked the Mango Lassi which had some good sharp mango flavor that I enjoyed.The entrees of Chicken Dhau and Fish curry was highly disappointing. Anyone could tell that neither the fish nor the chicken were cooked in the sauce at all. They were merely simmered in the sauce a few minutes before serving as none of the flavors seeped in to the poultry or the fish (salmon). Both entrees were served with a serving of rice and a small bowl of lentil soup.The onion Naan was unremarkable. I have had better almost anywhere.Not going back.
55,"Yesterday I went to eat here with my husband. This review is for vegetarians. We order veggie momo for appetizer, malai kofta, rosemary naan, vegetable biryani.The lentil soup that they served was ok. Nothing great for me. My husband loved it.The veggie momo was also ok. it was kinda chewy. again nothing great.The malai kofta and vegetable biryani were spicy. we had asked for medium spice but it was way more spicier. The extra spice was not doing anything to do the dish. It felt like some chili powder had been added to the dish as an afterthought. It definitely didnt come together.The standard fare vegetable biryani was the biggest disappointment. It was a mish mash of vegetables and overcooked rice with the spices not jelling together. The rosemary naan was warm and soft and the basmati rice that came with the entree was also good.I am giving two stars because of the let down of some of the most famous dishes and also the steep prices.The service was very courteous. Will I come here again? Nahhh, me thinks not."
56,"The place was filled with people, but I have no idea why. Food was quite poor. You can usually judge a spot by the basics - the rice, simple veggie dishes, tikka masala, etc. nothin stood out, and almost all were bad."
57,"I haven't had any Indian food lately so decided to come here and try their lamb momo. I don't know if the momo is authentic Indian dish or not but I do know that it's Mongolian main dish called buuz. Anyways we went there and I liked the lamb momo. But their food portion was extremely small and expensive.My husband had asked me if we ordered samplers instead of dinner. That proves how small was the portion. It was kinda funny tho. I laughed it off.We had groupon 10$ for 20$ deal and we told the waitress, seems she's the only one who fluent in English. Her response was Oh okay, as long as if you order MORE!...? than 20$ food then it's fine? I don't know what was she talking about. My husband was confused with that response too. Anyways rice and lentil soup comes with it for free. Usually Indian restaurants charge extra for rice and lentil soup.And their tandoori chicken wasn't cooked well all the way through. My lamb masala was good but I won't really brag about it. Place was pretty full actually I was amazed how they keep it almost full in that area where every corner has a Indian and Thai cuisine next to each other and it was Monday night tho. Cons was the portion was way too small for price I paid and watered lentil and dusty walls. The lentil soup was bland cuz they added way too much water to it. Normally lentil soup is thick not watery. I know it's comes with the dinner but still I prefer quality than quantity.Place needed some wall dusting too.  Definitely won't come back."
58,"This place was just another disappointing Indian restaurant/money pit.My girlfriend and I shared the mixed tandoori rubber chew surprise, mango lassi, and some other entree thing that isn't memorable enough to remember. What I do remember is thinking how greasy and awful tasting even the rice was.Maybe this place has better food usually, but I couldn't help feeling like $40+ was a lot to spend for a completely dissatisfying meal."
59,not worth it.the naan tasted like pizza dough.the rice had zero seasoning.i'd rather eat something i actually like.
60,"We ordered food from this place via a delivery service tonight. First time having their food. Overall for the price I was not impressed. The only dish I found outstanding was the chicken nauni, described as a himalayan style makhani. Now that was better than most I've had. We ordered all our dishes ""Indian spicy"". The chicken did have a slight spice. But our vindaloo was hardly spicy. Maybe a 3 out of 10 where I would expect a 7-10. The onion naan was good; the paratha not at all how I like it.Will try another place next time!As others have noted, the portions were on the small side given the price."
61,I was excited about this place so I decided to give it a try.I ordered lamb and brown rice. the lamb was very overcooked and brown rice wasnt prepared correctly. My friend ordered chicken and after an hour we both got stomach ache.my overal observation:The service was ok.The food was not up to my standard.I dont think I'll be visiting this place!
62,"I had high hopes from all of the yelp reviews and first and foremost suggest getting a reservation if you plan on dining on a Friday night there, waited for an hour outside before we could finally be seated.  Which I took to be an even better indicator of the food, we (group of 2) were in company of many others waiting for a seat too.  The Vegetable Pakora was really inexpensive and ok, not full of flavor, but all right.We had the Chicken Tikka Masala (not a fan of this version, and I normally love Tikka Masala), Okra (really greasy and dripping in oil, plus still quite slimy), and an Egglpant dish (not a fan either) plus Naan and Roti.  The Naan I was also not a fan of but the Roti was very good, even held up very well the next day as a leftover, whereas most Naan don't.The Chai was ok, I did have a Mango Lassi that was pretty good.  I don't like to give few stars, but I had high hopes for this place and won't be returning."
63,"""food is NOT spicy enough, dumbed down curries""Generally ambiance is nice. Reviewers talk about the decor a lot, I thought it was warm and friendly but not OTT. Service was not good enough for the amount they are charging.We saw people receiving things they did not order and generally the female Nepalese women did not understand enough English to make the experience enjoyable. Once the food is delivered to your table you would think that they would come back to see if everything is ok, no one came to our table. Once we were finished with our meal, you would think that when they come to take the plates, they would ask "" how was the meal"" they did not ask anything. I could go to any one of the other places that have order at the counter and sit down and eat experiance nearby for 30% less than what we payed here.Everyone receives lentil soup with the meal. It was a nice touch and we enjoyed it. It was however not spicy enough and too bland.We ordered the butter chicken and a lamb curry. We asked both items to be spicy, however they were very, very  weak. The curries were just ok, they lacked complexity of ingredients and they were not complex enough for our palate. I would almost say that they were just slightly better than a jar of Trader Joe's curry. I don't believe the chef was in any way ""experienced"" in the art of making food taste unbelievably great. To balance the criticism of the curries, the lamb was tender and the chicken was bite size pieces. I did not have a chance to try the Tandoori dishes so I cant comment on those items. The  naan again disappointed, it almost felt like an oven baked bread.I will not visit this place again but I give a 2 star rating because it may appeal to most of the Caucasian clients. (they probably don't know how it is suppose to taste)I don't get why this place is getting anything above 3 stars?"
64,"Okay, I live part time in the Indian Himalayas and have lived in Nepal so I think I have some idea of the food of those regions. And this really isn't it.  It isn't bad food, much of it is quite tasty. But it bears about as much resemblance to food served in Nepal as a can of Campbell's potato soup does to a proper Vichyssoise. The simile doesn't really go that far. The food at Taste of the Himalayas is, in quality of ingredients, pretty upscale. It's a Gourmet Ghetto restaurant after all. It's just not very Himalayan. Maybe it was the seafood that threw me off. Excuse me but there are no prawns or salmon in the Himalayas! If I found someplace up there that purported to serve it, I'd be running the other way, knowing that it had some really strange provenance. Refrigeration is a dicey prospect pretty much everywhere in the region so you aren't going to get seafood in an edible condition.The momos weren't too bad. I've eaten momos in Nepal, North India and Tibet and these were at least kissing cousins to the real thing, though again a bit precious and gourmet. I found the sauce a bit bland compared to the katsa that's usually served with momos in India and Tibet. The naan is really good though. It's also quite expensive, especially the naan of the month which had a sprinkle of herbs on it that cost an extra $1 on top of the already hefty $2.50 for plain naan. It was tasty and the texture was nice, but really, three and a half dollars for naan with a dollop of rosemary? Which, frankly, is an herb I have never once encountered in the Himalayas!A word to the wise - if you have allergies, be careful. Even with a pretty careful explanation of a pretty simple allergy, one member of our party still ended up unable to eat the food because they had gone ahead and put unnecessary tomatoes as a garnish on a dish that was supposed to be tomato-free. So they don't really understand that allergies don't constitute a preference, but a medical condition!Service here stinks. We waited a long time for everything, had nobody check on us for an entire hour during the meal when we could have used more water, etc. That would never happen in a good restaurant in India or anywhere in Nepal!The herbs were moderately familiar as ones used in Nepal. I found it all underseasoned, bland and not particularly different than any other assembly of meat and vegetables in sauce. If you want Indian food, there are a lot of much better places in the neighborhood. If you want Himalayan food, try one of the other places that specializes in foods from Tibet and Nepal. This just isn't it. Its' Berkeley foodie food with a smattering of Nepalese or Indian herbs and spices. And priced accordingly.  My friend Prakash who runs a restaurant in Kathmandu would be appalled at the service and the lack of depth of flavor.Oh, there is a really nice mural on one of the walls. We enjoyed looking at that."
65,"When I eat Indian Food, I  need  to not eat for a solid  6 hours before I begin to endulge myself with Spicy Chicken, Samosa, Shrimp Curry and Biryani with Lentil soup to start.I came here with Elana  and we were impressed with the  art on the walls,cleanliness and presentation of the dishes . IT was not the best Indian food that I tasted because  the spicy chicken tasted like it was mirowaved and not freshly prepared like the other Indian experiences that I had. The shrimp curry was decent but it was a little watered down. The Biryani was delicious!!   I ate the entire bowl which was the majority of my meal. The Samosas was not that great either because I kept having to spit out  what appeared to be the  hardeing of the pea shell, or the skin of the green chilles. The filling was not gounded out to smooth perfection.The main server was rude too. We were trying to have a conversation after dinner and she returned to our table assuming we were ready to pay. When we told her, ""Not Yet"", she and  the other servers kept  looking at us and watching us untill we put down our  debit cards.. We felt rushed. It was very uncomfortable, and rude.If you want a cheap, convenient , dining experience and yourn for Indian food, then come to this place. If you want to enjoy your dinner at your own pace,with  fresh,spicy exotic,rich flavors that does not taste like 5 day old leftovers , then go else where.. Not here."
66,"We went here with a Groupon (or similar offer) and were hoping for a real ""taste of the Himalayas"".  Sadly, the waitstaff was clueless, as is the menu, about which dishes best live up to the name of the restaurant. We picked a couple of recommended dishes and were delivered truly awful food. It was nothing more than generic, cookie-cutter Indian food, not even as good as Trader Joe's frozen Indian selections. The service was as bad as the food. I can't believe this place packs 'em in the way they seem too. There really is no underestimating the taste of the Average American! Please avoid the sad excuse for a restaurant!!!! For something more Himalayan, try Mt. Everest on Telegraph (stick with the Nepalese dishes), or Kathmandu on Solano. This place should be forced to change it's name to ""Bad Taste of the Indian Subcontinent""."
67,We were not impressed.  Nothing special.  Basic Indian food with a smattering of Himalayan dishes.  They were skimpy with the meat too and the prices are not great.
