,review_text
0,"I was really disappointed with the restaurant especially knowing it has 4stars rating on Yelp.The momos was hardly comparable to the ones I've had in Hong Kong. The lamb was still a bit uncooked. (I had stomach problem later in the day, not sure if related to this.) Quite a few of them also had broken skins.Samosa was dry and pretty bland. The garlic naan was good and probably the only decent dish of all.Chicken Tikka Masala had nice sauce but the chicken itself was pretty dry. Shrimp vindaloo was okay but there were only a few shrimps inside.The mango lassi had too much yoghort inside and I couldn't really taste the mango.Overall the serving portions were really small (except for the momos, which we couldn't even finish) and the taste was barely okay.This was probably one of the worst meals I've had this year. Definitely not coming back here."
1,"Got the Groupon for this restaurant and had lunch there recently. This restaurant is nicely situated next to some other cool shops and restaurants in Berkeley. I had high hopes for this restaurant delivering on some quality Indian and Nepalese cuisine.There was not a lot of flexibility on where we could sit, despite the near empty restaurant. We were steered towards a small table in the back and middle of the room. I think I was seated in the darkest part of the restaurant - highly recommend sitting closer to the windows with sunlight streaming in or center of the dining room.Service was delivered with a smile but was pretty slow. The mixed biryani was fairly bland. Samosas were just OK - needed more flavor and seemed to have used the bare minimum in spices. Don't be fooled by the value offered by the Groupon - unless this place can up the taste and flavor of its entrees, it's not worth spending your time or energy trying to dine here.UPDATED: After I posted this, Manny A. sent me the following note, labelled as a ""compliment""Manny A.San Francisco, CA 0 friends 4 reviews 4 photos Just a Note 5/18/2017For your review of: Taste of the Himalayas""Looks like your very sensitive person.i don't know your age but you sound like a lil cry baby""Wonder if the owner of the Taste of the Himalayas got upset and had his buddy bro send me this nastygram...lol. In any event, I guess the truth hurts, and my review upset someone. Sorry, next time do better."
2,"One of the worst restaurant meals I've ever had. Dishwater broth, Naan was greasy and under cooked. The rest of the meal was poor in taste and portion.Service was rude and incompetent.This was a couple of years ago, perhaps they've improved but I won't know. Only blocks from home, but it was so bad I'll never go back."
3,"Food was alright didn't really had taste to it everything tasted the same except the Chicken they were pretty good,Mango lassi tasted like over dose of yogurt no mango flavor Make sure to ask them for utensils when you order for delivery they do not even include napkins"
4,"Not once have I stepped into this place during my time at Cal, but I've heard the raves of this place over the years. So, at long last, I went with one of my besties (who loves this place).The first thing I noticed was the glasses of water placed before us. Our cups were dusty! My friend noted, ""That must've been from the linen they used to wipe the cups,"" but who the Hell would wipe cups with cloth that sheds???Then, we made our decisions of what to order, set down our menus, and dived into girltalk...*spoken in the Spongebob voice*...20 minutes later...ME: Wait, why hasn't anyone stopped by to take our order?FRIEND: Oh yeah, you're right...It was a busy Saturday night, but that's no reason to neglect a party of two.When a waiter did come around, we ordered Chicken Tikka Masala with medium-level spice and Garlic Naan. Everything tasted bland.My friend loves the gulab juman for dessert, and we were waiting around for a waiter, since I wanted to try a good gulab juman (we went to another place where it was soggy and cold, with terrible service). But while we waited, I thought, ""If the food is nothing special already, and the service is so slow here, why would the gulab juman stand out?""Decided not to get gulab juman. Signed our checks and left."
5,Ordered the Tandoori Shrimp.It wasn't good.  The dhal was watery and bland.  Rice seemed reheated.  Vegetables were hard and flavorless.  Not good.  Online ordering system requires payment upfront even if you're using a Groupon.
6,"We wanted to have some Nepali food, it was good greetings and all those stuffs while we just entered, we ordered our foods, momo .......... after like 25 minutes I had to go to restroom, when I came back all of my left over was taken I was so pissed off the intro was good body was ok but the main thing conclusion was horrible. I will never ever go back to this place and u know what their momo sucks and it's freaking expensive, I know it's Berkeley downtown the rent is high but at least the food should be good enough, but it's bad I don't know I guess it's only for us I don't have any issues with the workers or the owner or anyone related to this restaurant I am just saying what we felt like"
7,"BEWARE: 6/23/16Food was aight, and I'd probably come back again if I had a normal experience, but I think I got food poisoning because I woke up at 4AM and my stomach was NOT happy.I've gotten food poisoning in the past from eating various types of street food in different countries, but this was a first in the US. Definitely disappointed."
8,"Right in ""Gourmet Ghetto"" of Berkeley, this place attracts all the newcomers to the area and their decor is quite inviting. Their food was OK, but their service has definitely gotten better over the years. I went here a total of three times. Each time the food quality seemed like they tossed in the few pieces of meat and heated it up on the stove. The meat pieces clearly didn't  simmer long enough in the gravy or soup base they came with to have that flavor permeate throughout the pieces of meat. So. Yeah. Having eaten a hundreds of restaurants over the years, I know the difference between meat that is actually *cooked* in the gravy that it came with, or just a few pieces of meat were tossed in and heated up with the gravy. Maybe it is because this particular ethnic food group takes a lot of preparation."
9,"Sad that this place is not as good as our first visit. First time we came, they had just opened and had some good deals and food. This last time though was no good. Really long wait for food, found hair in the samosas, really pricey for the portion size, and not that flavorful. Seems like they didn't develop as great as hoped (or more customers and demand got them stooping to lower standards). I personally have been to many Indian restaurants way better. Highlights:-pretty paintings-good garlic naan: good flavor here, cooked well, hot when served. it was the best part!Drawbacks:-slow service: it wasn't even that busy the night we went, but still waited 30-40 mins for a dish that supposedly had been stewing all day, so should have been brought out easy and quick.- poor flavor: nothing notable. seemed way too basic compared to the description and expectations. we ordered the goat curry, which was described as stewing all day in lots of spices. did not taste that at all.- again, hair in samosas :( also, barely warmed when we got them. on the plus side, they brought out a fresh one which was actually hot.- no chutney! just tamarind sauce. we asked for something else with more spice (tamarind sauce was pretty sweet). nada.- too pricey: for the experience and quality of food, the price was not worth it.Sadly, will not go back. Seems like they are catering too much to a particular palate that is not tuned into this type of food. I've had a lot of Indian food from many places. If you are an experienced eater also looking for good quality Indian food, I would NOT recommend this place. womp womp!"
10,"The wait for the food was 60 minutes. The food quality was very mediocre. Tried tandoori chicken and it was not worth it. After waiting one hour for the food, there was no apology nor smile or anything."
11,"The service was very good.  Our server was attentive, friendly, smiling and even thanked us for coming.  He always refilled our water glasses.   The man who seem to be the owner was nice too.The menu prices were expensive.  The mixed momo (3 pieces of dumplings each of vegetable, lamb, and chicken) $10.95 were dry, not plump and juicy.  It came with a small bowl of tomato chutney.  The dumplings are small.  The photo looks deceiving.The naan was thick and comes with one cut up into four pieces.  I'm used to the naan being thinner at other Indian restaurants.  The Chicken Nauni $14.95 was good but small portion.  Comes with basmati rice or naan.The Mixed Tandoori $20.95 was good but not worth $20.95.  It's too expensive.  It came with 2 pieces of tandoor chicken, boti kabab (Lamb), shrimp tandoor, and chicken tikka and served in a sizzling hot plate with sautéed onions, bell pepper, cabbage, carrot, and spinach.  Comes with basmati rice or naan.  The Lamb Biryani $15.95 which is basmati rice cooked with lamb, herbs and spices was ok. Not sure if I'll be back."
12,food here is very inconsistent. The soup always needs salt and the naan comes out burnt about 50% of the time.The curries are ok but for the price it's not worth it.
13,"Long wait. Food is really bad, worst Himalayan restaurant I've tried. Chicken TikaMasala, Chicken Biryani, Okra dish and Kheer is very bad."
14,This was a rather disappointing lunch experience.  Walking in for lunch around 100pm ... It was pretty slow ... Waited a moment for someone to come out and seat us . We were handed  menus and glasses of water . Looking at the menu. We needed up ordering  vegetable samosas and one of their entrees to share . The menu states that  every entree gets a bowl of lentil soup and a choice of brown or basmati rice or pain nann .... We ordered the garlic nann thinking we could upgrade to the garlic and pay difference ... The samosas came out just a few min before the entree .. They were two  big warm samosas served with a tamarind sauce ... It was good but not amazing  and I wish they had a mint sauce to go along with the sweet  tamarind sauce ... Usually places have them . Anyway on to the main entree ... We did NOT get our bowl of lentil soup !  Idk I should have said something but you know when sometimes your just so disappointed with an experience that's it's just not even worth the energy to say anything? I'm not sure if that makes sense but anyway that's how I felt . The garlic nann bread we got was an extra 4.95 to the bill .  It was one large flat piece cut into four ... It barely had any flavor and was very very dry . The rice that they just happen to choose for us .. We didn't ask for the rice cuz we thought the garlic nann would replace it .. Was tasteless and again very dry . The tiki masla sauce was good but the chicken was over done and DRY !!   It was just an underwhelming dinning :(
15,I went with high expectations. I left flattened!Service: Pretty bad - the server was argumentative and had no clue about customer experience.Food: Pretty bad - the goat curry lacked complexity of flavors and the meat was chewy and undercooked. The Chilli Chicken was sub-standard. Naan - all flour.. and nasty!! I have never tasted naan so bad. Ever. The rice was cooked nicely... the daal was OK but served lukewarm. Amateurs at best!Prices: More expensive than most Indian restaurants in all of the bay area. One trip too many. The Himalayas taste a lot better than this TOTH.
16,"I have to say, this is a mixed bag review for me. Having had worse, the food was pretty good...at first. The delivery driver (Grub Hubed it) came to the door and explained they were out of their yogurt dip Raita. However, they could not credit me or exchange anything for the cost (so out the cost apparently). The food, plentiful with mixed tandoori, which came with a tasty lentil soup, tossed salad, lamb momo (dumplings) and a couple other speciaties which I enjoyed...at first. Then...the dreaded one hair (and certainly not of mine) in the salad. I can get past it I thought, holding back the reflex to heave, and so just moved on. Then about three bites into the tandoori dish, yep another (pitch black and about 4-5"" long)., then another. Started to think the chef had mange. Anyway, that pretty much ruined my dinner, but the dog had a good time.Figured I will call and make a formal complaint but don't want to act like I have a hair up my...uh hem."
17,"In a nut shell; Food is really mediocre, and they need to learn something about courtesy in treating their guests...I definitely won't be going there any more, especially that Berkeley have a Merida of far superior restaurants offering the same cuisine..,"
18,I had read a lot of glowing reviews of the momos here. I was frankly very disappointed with the food. Let me tell you why. First and foremost the momos tasted like they were stale and cooked a few nights before. I must emphasize that I was there during lunch time. They could very well have heated up the leftovers from last night. The momos were lukewarm and had bit of a sour/tangy taste to it. Coming from Nepal I know what good momos taste like. And this my friends was certainly not one of them. At Least not for lunch anyways. The only thing good about the momos was just the sauce. Sauce = 5 stars momo = 0 stars. Aggregate = 1 star.
19,"Got take out from here because of the Groupon deal. The food is definitely created for the American palette, and is definitely pricey given the quality of it. I wouldn't really recommend it to anyone. There are definitely way better places in Berkeley. Even Mint Leaf right up the street is better than this."
20,"Have to agree with most of the recent reviews I read.  Friendly service, but dinner did take too long to come out.  None of the dishes were bursting with flavor, and overall the result was ""meh"".  Green tea was literally hot water and a tea bag.   Was seated near the door, and proceeded to get blasted by cold wind every time the door was opened.  Came here for moms birthday, and sadly this place didn't create any memories."
21,"Decor is nice but the ""free"" lentil soup is pretty nasty and the curries don't have any flavor. They definitely overcharge though as their portion sizes are small and naan is extra. I also ordered a glass of red wine but when they served it, it had gone corked (ie spoiled). I notified them and they gave me more wine (not the one I wanted, but something they said was 'a very good one' whatever that means) which would have been fine BUT THEN THEY STILL CHARGED ME $7 FOR IT. Why would I pay for something that you served spoiled, and then didn't have a new bottle of the actual wine I wanted?"
22,"I've been here several times, and it is a consistent Indian restaurant. The food is okay, but the main reason I only give to stars is that it is also underwhelming. There are no real highlights. The food is decent, but not great, the atmosphere is ok, but not really inviting, you get a decent amount of food for your money, but it is still on the more expensive side. Remembering that this restaurant is in Berkeley's gourmet ghetto, it is really not enough. One major turn-off are the steel metal plates for lunch. It looks more like a cafeteria or prison than a restaurant."
23,This was okay but really not sure why it has 4 stars.  The menu was interesting but the food was luke warm and a bit bland.  I asked for medium spicy and it was not spicy at all.Definitely had better indian food with better service.  It is not terrible but definitely not 4 stars
24,"What the actual hell? My bf had a restaurant.com $25 where we had to sped a min of $37 or something. I normally don't like Indian food but my bf loves it and even lived in India for a summer in the past. We ordered the somosa, mixed momo, garlic naan and mixed tandoori. The somosa and complimentary lentil soup came first. We didn't finish the somosas bc they weren't that noteworthy but the chutney sauce wasn't bad and save the dish. We waited what seemed forever for the rest of our food.While waiting I noticed this huge fly on the wall next to my bf. I pointed it out to him and we shooed it away but it kept coming back. The girl behind her started freaking out bc at some point there were two huge flies. My bf and I moved one table over and the couple behind us moved across the restaurant. I understand that the restaurant can't do much for flies but it's still really gross considering what flies usually land on.... The waiting continues at the new table..... Literally two couples that came after us, came and went. We asked our waitress about our momo and she said it was coming.... 15 min later we asked again and finally the naan and mixed tandoori came. We thought it was weird that the main dish came before the other appetizer. But we were hungry so we dug in  The mixed tandoori was super bland and was mostly chicken with only one small piece of lamb and 2 pieces of shrimp. I'll give them a point for cooking the chicken so it was tender but take it away again for being bland. My bf had to ask for sauce to eat it. We asked about the momo and it was obvious they forgot about it. We asked for it to go instead and continued to eat our food.... 20 min later and the momo is STILL not there. They cleared the table, we paid and we continued to wait. I was literally pulling my hair out and one of the waitresses came over like .... Hmm is there anything else I can do? Uh.... Our momo!? Her: oh it's coming SURE WE HEARD THAT ONE BEFORE At this point we were like what IS this momo !? In the car we opened it up and it is literally dumplings... an hour to make dumplings... Were they making them fresh during that hour or something ? Well we will be eating them for breakfast tmrw and I hope they're mind blowing."
25,"HAH! so funny story, after I wrote an honest review of my experience at Taste of Himalayas, the owner reached out to me. Aside from apologizing for the rude services and the craze that the menopause woman went out on my party & I, Rajen (the owner) accused me of being abrupt in my choice of words. Hm, okay.... no where in my review did I used any profanity...(except in my assumption, HA -- but hey, at least i quoted it ;) ) nor did I made the rating without a thorough explanation for why I did so. I write what I feel, and besides, Yelp is for customers to draft their honest opinion on their experiences, not to buffer and skew their negative experiences so that the Owners can feel better about themselves. Well, I'm sorry, but this isn't a testimony for your website so you can rave to your customers about great and wonderful your restaurant is. I'm sorry that you didn't like my review and I'm sorry that I ""upset your workers"". Your workers wouldn't have been upset in the first place, if she did her job well. I mean, if you are not a people-person, I suggest you get out of the Customer-Service industry. Better yet find a job that are more competence with your Type A personality. Possibly for the DMV or somewhere in a corner so you don't have to deal with customers, like myself (: Last but not least, I'm sorry Rajen, I can't simply delete my review nor edit it to your taste. First of all, as the Owner, it is YOUR responsibility to try and accommodate ME. (so why am I saying Sorry so much ?? sigh, i guess I just believe in forgiveness a little too much as well)Maybe it was MY fault for coming to your restaurant in the first place expecting good services. You should probably put up a ""WE HAVE POOR SERVICES, SO DON'T BE SURPRISED"" out in front of the store... than I would've been more lenient on my review..--.maybe. so Thank YOU & Have a Wonderful Holidays!"
26,"Waited over 30 mins for a dinner for two ppl. They brought our dinner right after I said something to the waiter which makes me wonder how long it would've taken if I hadn't said anything...On a brighter note, the mango lasi was good."
27,Can I give a negative star. The wait staff in here are awful. So rude. Never coming back. First time there and won't be back ever. Wish it were different.
28,"Ordered delivery. It came quickly and was plentiful in portion size. I have been ""yelped"" (not sure if it is a real term but coining it right now); I picked this place for the great reviews but was seriously duped. The food wasn't bad but it was not good. The vindaloo sauce is tasty but the spices they use (ginger, cardamon,  cloves) are in there and fighting for dominance. I bit into two cardamom pods and a few pieces of ginger. It left really strong flavors in my mouth that conflicted throughout the whole meal. The tikka masala was pretty sweet but good. The naan is not worth it. It is not real naan with a thin and crispy from spreading the naan mixture on the side of an oven-like kitchenware. It tasted like it was made in oil and was really thick and dense--more similar to native frybread.  Overall, I don't think I will try the place again."
29,We get catering from this place at work and the food is decent.  I decided to go try it in person and there were at least 4 open tables but they just ignored us and didn't seat us.  We ended up leaving the restaurant after we saw that they seated people who came in after us.
30,"With a 20 dollar off coupon and a tip on the original amount, the bill still came out to reasonable- I shudder to think of paying full price.  The main flavor in the food was salt- the waiter told me I should order mild instead of medium if I was unfamiliar with their spicing, but the mild was... salt.   Awkward service- a woman threw down napkins on our table and walked away.  If you look under ""non reccomended reviews"" you would see many one and two star reviews."
31,"Call me culturally ignorant but the food I ordered here was no different than Indian food you'd find at a $10 AYCE Indian restaurant. Nothing partularly memorable about the food besides how bland everything was. Just a little salt and pepper  across all dishes would have easily brought this review to a three star but sadly the omission of these basic ingredients made everything bland. On top of being bland, the Chicken Tandoori I got was also very dry. I honestly don't know how you run a business selling a plate of four chicken drumsticks for $16 if you can't do it well. I would recommend the dumplings here since they are quite tasty versus everything else I had (though to be honest, the filling was on the dry side). Overall, I wouldn't come here again given the cheaper and tastier Indian options all over Telegraph area in Berkeley."
32,"Filling but definitely not exceptional noms for the price.Delicious samosas & tamarind chutney. However, the momo's came out luke-warm, at best, and weren't very memorable.  The lentil soup that comes with the entrees was piping hot but had minimal pizzazz even after adding salt & pepper. The Kukhura Chiyau Tarkari had a lot of mushrooms in it but didn't have the best cuts of chicken and the sauce was a bit bland. However, the Lamb Tarkari had a delicious sauce.Another issue was that we specifically had asked for our dishes at ""medium"" spicy and the waiter stopped us to ask, ""Well have you been here before? How spicy can you handle?"" Seeing as I hadn't asked for the ""hot"", I thought that he was signifying that their dishes generally run on the spicier side, so we bumped our dishes down to ""mild"". Then, when they came back out, they had absolutely no spice on them. Maybe it was a communication barrier, but don't talk me out of what I want to order unless you have a good reason.We did get a free dessert with the Yelp check-in, though."
33,"Bit into multiple whole cardamom pods in my Alu Cauli Ko Tarkari. Super unpleasant. For $12, it wasn't worth it."
34,"This place used to be such a great place for dining. But for the past two/three years everything had changed. Our food was SWEET - this is not a compliment, it means that every single dish had added sugar in it - Lamb Curry, Naan, Rice, Vegetarian Potato with Peas and other dishes we had. Food seemed to be watered down a bit.Additionally, the smell of 'Fresh Linen' toilet deodorant was so prevalent, even though we were sitting right by the main entrance door."
35,"This place is way overrated. I had the chili chicken and the meat was not fresh at all, totally warm like it was microwaved, the rice they serve is horrible quality, it's super dry and stale. It was first and last time here. I wonder how it has all these so called good ratings. Never coming back after I wasted $45. Smh."
36,"I do not like the ownership whatsoever.  they are stingy and rude - they often ""forget"" to bring me the complimentary soup - and even when I ask, they are hesitant - the soup is so cheap they should be using that as a way to make customers feel nice, not upset at their stinginess.  Their food is not very good, it is mostly indian food - and i've had much better curries and biryani.  They put very little meat in the meat curries (again, stinginess).  Their momos are the only thing worth going for and lately they've changed the sauce to have sesame seeds, so it is not as good.Don't bother going there...go to Mount Everest Cafe in Berkeley on Telegraph...great service and food!"
37,"I have not been in a restaurant where they serve one dish 30 mins after another! I have to let my roommate eat otherwise it was going to get cold. By the time my food arrived, he was done with his meal. Biryani was bland and there was nothing great about the veggie curry that the waiter suggested. On top of that, they charged me twice!! I will never be coming back to this establishment! I made a mistake coming here! Himalayan Flavors was where I meant to go and that place was much much better!!"
