,review_text
93,"I went here for the lunch buffet and was not impressed. I can't comment on the service, because there was almost none needed with the buffet, but the food was seriously lacking. The number of dishes in the buffet was average, maybe 8 or 10 total, with 2 or 3 meat dishes offered, but everyhing looked and tasted watery and bland. The sauces were so watery that they soaked right into the rice and didn't contribute to the flavor, so I was left with watery rice and bland vegetables. The naan, rice and kheer dessert were average. I would not recommend this place for lunch.We went to this place because someone had gone here for dinner and enjoyed it, so if I decide to try it again and go for dinner, I may have to revise my rating, but for now, 2 stars for the buffet."
94,"My partner and I decided to try this place out on a Friday at 6:30.  The place was half full with at least five tables free yet we were told that we would have to wait for a table to open up by a grumpy woman, it was a bit absurd.  We watched her pace the restaurant with a frown on her face and if it would have been up to me we would have left right then.  Luckily when we were sat we had a really nice waitress.  We ordered Samosas, Mismas Tarkari, Saag Tofu, and Paratha.  The Samosas were okay, the only thing that I didn't like about them was the whole cardamom and whole cloves throughout which I just am not fond of.   The lentil soup that came next was pleasant with a nice toasted cumin flavor, I could eat this all the time.  Now to the entrees, ick!  The Mismas Tarkari or curried seasonal veggies was bland and the veggies were crunchy not anything I would have expected or wanted.  The worst though was the Saag Tofu which really had absolutely no flavor and tasted like boiled whole spinach leaves in a flavorless oily tomato sauce with big pieces unflavored bland plain tofu (and I love tofu!).  The Paratha was okay and seemed fresh but again bland bland bland.  I was actually salting my food which NEVER do!  Now as if having a crappy bland dinner wasn't bad enough, the prices are ridiculous!  $11 for a small bowl just rubbed me the wrong way.  There are so many delicious places that are so much cheaper, I just don't get it."
95,"Again I often rate a place by value, and I didn't find that here.  The food was  a little pricey for the east bay and had no ""wow"" factor what so ever.  To boot the service was sad, at best. How many time must one ask for water when there are only 3 tables filled in the place...apparently five."
96,"Got the $11.95 mixed ""seasonal"" vegetable dish and was very disappointed. The carrots had that spongy texture from having been frozen. The green beans were likewise mushy. Some mystery veggie was so woody I had to spit out the pulp. I expect more from a restaurant in the gourmet ghetto and here in Berkeley with farmers markets 3 x a week. What a rip off!"
97,"WORST service ever! I went there with a restaurant.com voucher and the owner got really pissed off. He snatched the voucher from my hand and said ""Don't come back here again."" I was absolutely shocked. For a second I thought I should've thrown the food on his face. Really, I still can't believe why he said that to me. When I asked him why he even participated in the program, he replied that he could do whatever he wanted and that doesn't mean I should jump in to take advantage of it. This place should get negative stars for this. The food was decent, but Kabana has better food."
98,"I was really impressed by the lentil soup, which is the best I've had, so I was really excited to try the samosas, roti and Palak Paneer we ordered. Unfortunately, it went downhill from there. The samosas and Palak Paneer both contained my biggest pet peeve when it comes to Indian food...the whole spices were not removed prior to service. I don't know about you, but I do not find it pleasant to bite into a whole cardamom pod or chew on whole cloves; it really overpowered the flavor of the dishes. The paneer, which is my favorite part of Indian food, was off-tasting...not as creamy as I'm accustomed to and lacking flavor to the point of resembling tofu, which I like, but did not order. I was hoping the roti would help put out the burn in my mouth from the ""mild"" Palak Paneer, but it never arrived...instead we received naan that was dry, overcooked and possibly had been sitting out for a while. The wait staff was pleasant at first, but would not stop hovering after dropping off the check. The restaurant was half-full, so there was no reason to rush us out, but the wait staff kept looking at my friend and me as though they wondered why we hadn't left; it was so uncomfortable that we did get up and leave one we paid the bill. As much as I was impressed by the lentil soup and the decor, I don't think I'd go back here."
99,Why go here when you can go to Everast Cafe on Telegraph? The food here was not nearly as good and the prices were much higher.
100,"I've only eaten here once and decided to try the lunch buffet. Everything was boring and flavorless. The spices were sorely lacking. I was the only customer in the entire restaurant! I would not recommend the buffet, and probably would NOT give it another try."
101,"Food was similar. The sauces were barely different. Tasteless, overpriced, and really just not that good in general. service was mediocre. And then to top it all off, my gf found a hair in her tikka masala. A black curly hair, and when shown to the waitress she just stared blankly. They knew who it was, so be careful when you go here. Not a good experience.  The only positive was they let us out for free because of the hair. Never going back.  a hair. so gross."
102,"Overpriced Indian food. The tandoori chicken was very dry and burned. Goat Saag was good, but the lamb meat was very tough.  Atmosphere is good, decor is nice.   restaurant.com offers discounted gift certificates which was the only reason that brought me here.    Not coming here again, Naan N Curry has much better Indian food.  Oh, Parking is horrible too."
103,"Based on the good reviews, we decided to try this local restaurant.  The staff were friendly and the decor was nice.  However, the food was very bland and served lukewarm."
104,"The food here is good but not worth the price.  You can have a better palak paneer down the street at Biryani House for less than half what they charge here, if you don't mind the lack of ambiance.  The one they do here is bland."
105,"Overrated. Nice service, bad food. Bland is the best word to describe the food here. If you have pathetic taste buds and don't like flavor, this is your place. But otherwise, don't do it, don't go here, you will be disappointed. There are better options."
106,"The blandest channa masala I've ever eaten.  The sauce for the momo nothing to brag about either.  I stupidly ordered a Yeti beer, which has the sickly sweet taste of brews that have too much alcohol content (7%)."
